Date,Url,Reviews
2024-03-29,-,"My company uses Monday to assign our appointments and result leads. I am constantly dealing with insane lag times. Takes forever for my appt list to load. We as a company have missed dozens of appts because the appt lists don’t update in time. You have to wait sometimes 3 mins just for the lists to update properly. When we save our entries, they always get deleted. When you use an app on  daily for crucial situations, you need it to be reliable. And this app is not reliable at all. Our owner is too busy to find a new program and we had high hopes with Monday. As a company we all cannot stand it anymore."
2024-03-25,-,"Frustrated with how the app works in iOS and does not preform as it should. There are so many bugs that Monday.com refuses to address and fix/resolve in a timely manner. Poor testing to insure everything is working as it should for every menu and functionality. Does not up update or refresh immediately as it should. Great concept, extremely poor execution and testing!!"
2024-03-21,-,Used it then stopped as soon as we got our first invoice and saw where they were based.
2024-03-19,-,"Love that the app on a phone lets you look at your list to complete. It is harder to create items on the Phone app. It is easier to look at different views on a desktop version. I love the night view with different colors for each group.

I do wish that you could make a different boards and list different colors underneath work spaces. It would also be nice to be able to change a home workspace."
2024-03-18,-,Horrible app.
2024-03-13,-,Very easy and useful to understand
2024-03-06,-,"Super simple software program.
Very useful logging job site work,along with insight and info.
Would definitely recommend to others.
😁"
2024-02-28,-,The app barely works. It doesn’t update when you assign someone to something it takes a long time to show up in my work. Deleted boards still show up in users phones. Very disappointed.
2024-02-22,-,"It’s so good, I can’t believe it’s free."
2024-02-21,-,"I thought I signed up for all functionality. I paid for 5 licenses and then find out it is only for CRM and not Workspace. Very misleading.
Then it is impossible to get anyone on line to speak to."
2024-02-20,-,"Really like this app, absolutely recommend to any and everyone for work AND normal life. Best thing: information All in one place. Worst thing: UI maybe a bit better but it still is pretty good."
2024-02-16,-,Monday.com is great but for now the app is unusable. Boards are never in sync even when attempting to manually refresh everything.
2024-02-14,-,I asked for my account to be deleted and went through all the appropriate steps to delete it and it is still popping up!!!’ I have tried contacting customer support but no luck even reporting the problem. Next step will be to report to  the Better Business Buteau!
2024-02-13,-,"Seriously the only way I get anything accomplished with efficiency is through utilizing Monday. I’m adding to my title “Digitally Organized Queen” 💁🏻‍♀️
Thanks Monday"
2024-02-12,-,Fine for desktop but freezes all the time on mobile
2024-02-12,-,I will be the first to admit I was a little skeptical that this would just make me work harder or be confusing. However I love how good it feels to track all our hard work as a non profit. Still learning all the capabilities it has to offer. Over all definitely helps with time management.
2024-02-12,-,"Not sure what changed, but new Calendar View UX/UI is not good. Barely can see the week. Uses 60% of the screen. Clicking on events, now they don’t open. This was a poor design change decision. Please update, so when we click events in calendar it opens. Iphone user"
2024-02-09,-,Will not let me log in with Apple ID please fix asap as a business we are very intrigued fix asap
2024-02-05,-,Love the way this app is designed but there seems to be a major glitch and I can’t add a task. When I click to add a task under the Today view it asks me to select a board and then sits on the loading screen for the boards and never loads the boards. Please fix this glitch and I will update my review (I have an iPhone 13).
2024-02-04,-,My team and I started using Monday CRM and it has helped us quadruple our productivity and help keep our team on the same page with work flow. I highly recommend it
2024-02-02,-,"Unable to re-activate “Update,” column back to team tasks.  Otherwise pretty cool app. Thanks!"
2024-01-31,-,"So just like the title I have tried so so so many apps but this one is truly one that has helped me stay organized 

It’s also easy to use ; many apps I have tried have the same template in a different color , I think I am trying another app but no it’s just a different name but monday is different, unique and original."