Date,Rating,Reviews
29.07.2021,10.0,"One of the Greatest Movies ever made. Easily the best Time-travel story. Bar none. The writing is rock-solid, the double-act of Michael J. Fox & Christopher Lloyd are the heart and soul of this story and the timeless and epic score of Alan Silvestri gives the movie so much heart that makes it feel larger in scale.This movie has something that modern Hollywood lacks - re-watch value. Very few movies today have performances that make you want to watch them again. I can say that Avengers: End Game is a great movie, but does it have the same re-watch value as Back to the Future? In my professional & personal opinion - no.The First Movie has not aged a day - it feels fresh and new every time you see it. I have lost count of how many times I've seen it over the years but I still laugh every time Biff gets ""the make like a tree"" line wrong and the penultimate Clock Tower scene is a still a pulse-racing experience to this day.Back to the Future is a Movie that will be talked about and enjoyed long after we're gone.It's timeless."
29.07.2021,9.0,Best part from the best triology!Awesome Film with awesome music!
25.07.2021,10.0,"Beautiful film that never gets old and that always remains fun and engaging and that proposes a beautiful story, nice and very deep on time. The film is very interesting and manages to hold you glued to the screen for its entire duration without ever getting tired."
19.07.2021,8.0,"Well, OK, the beginning scene, were everything starts is a tad bit over the top.And by a tad bit, I mean a huge mammoth chunk. The time travel mechanics are stupid, but its OK.This is a movie that they want you to laugh at those things. They aren't serious about anything at all. So go ahead and have a good laugh, at all the insane time travel stuff.Oddly, just like Indiana Jones, this follows the Great-Bad-Good pattern. If you are thinking about watching the trilogy, don't stress out about the middle one."
14.07.2021,10.0,"My my kids got two days in a row of my pandemic Film Appreciation Course, this time introducing them to the 80s time travel classic ""Back to the Future."" My kids laughed at all the right parts, thought Marty and Doc funny, and were completely caught up in the excitement and suspense of the clocktower finale. During that clocktower finale, one of my daughters, who wasn't familiar with ""suspense"" as a film term said ""This movie is giving me ANXIETY!"" They were completely into the film, just as I was when I was 13 or 14 when I first saw it in the theater. Directed by Robert Zemeckis, who only had three movie credits to his name before this, the very funny TV movie ""I Wanna Hold Your Hand,"" the very funny and very crass Kurt Russell comedy ""Used Cars,"" and then ""Romancing the Stone,"" which was an unexpected hit that led the studios to take a look at his other projects. If you're wondering how Spielberg got involved in this film, Zemeckis and his writing partner, Bob Gale, wrote Spielberg's infamous bomb ""1941,"" which I think is an under appreciated comedy classic I still love to this day. Spielberg also produced Zemeckis' first film ""I Wanna Hold Your Hand"" and when the studio was uncomfortable with him selecting a first time director he stuck by Zemeckis but had to promise the studio if things went badly he'd take over as director. But I digress. In summary, ""Back to the Future"" has a great cast (even look fast for Billy Zane in his film debut as one of Biff's toadies), terrific humor, and genuine heart. Although seemingly lightweight, ""Back to the Future"" really is an American film classic. FUN FACT(s)! When Thomas F. Wilson, who played Biff, is asked about this movie by fans, he'll often hand them a postcard of frequently asked questions as a timesaver, which reads:""I'm Tom Wilson. I was in all three 'Back To The Future' movies. Michael J. Fox is nice. I'm not in close contact with him. Christopher Lloyd is nice. He is a very shy man. Crispin Glover is unusual, but not as unusual as he sometimes presents himself. We got along nicely. Lea Thompson is nice. Eric Stoltz originally played Marty, but was fired due to performance issues. The first movie was shot in 1984 and '85. The sequels were shot 'back to back,' never before attempted by a movie studio. The hoverboards didn't really fly, we were hanging by wires from a crane. The manure was made of peat moss, cork, dirt, and a food agent that made it sticky. The Delorean was an inferior automobile, and nearly impossible for a person of normal size like myself to enter and exit. There are many tiny plot points hidden in the movies, but I don't know what they are. Among many improvisations of the set, I coined the term 'butthead,' as well as 'Make like a tree, and get out of here.' The third movie was my favorite, since I got to learn western skills like riding, roping, quick draw, and shooting a six-shooter, a great adventure for a guy from Philadelphia."""
13.07.2021,10.0,The greatest movie mankind has ever/will ever create. No cinema will ever top this brilliant masterpiece.
09.07.2021,9.0,"What a classic! Marty McFly and Doc Brown are two of the best characters in cinematic history. The plot was fun, captivating, emotional and well driven. The film takes you to another time in a way other movies have not been able to do. Loved it!"
03.07.2021,10.0,"The first part of the ""Back to the Future trilogy"" was published in 1985. The director Robert Zemeckis and the actors, especially Michael J. Fox (Marty Mc Fly) and Christopher Lloyd (Doctor Emett Brown) as the main characters created a fantastic film with an exciting storyline. The filmography is to be assigned to the science-fiction and comedy sector with the mixture of action and a lot of jokes.
The crazy professor Emett Brown develops a time machine included a special invention - the ""Flux capacitor"". He installed the device in a Delorean, which runs because of the high energy demand with plutonium - a high energetic and radioactive element. When doctor Emett wants to present his new invention to Marty - a boy from the neighbourhood - he was shot down by lybian terrorists, from whom he had stolen the plutonium earlier. To escape the dangerous situation Marty must use the time machine. Before he could do anything Marty lands in the year 1955 where he must save the professor and not at least himself and his whole family.
In the first part and also in the two others of the ""Back to the future trilogy"" there is a classic fight between the good and the evil. Biff Tannen and his gang are the bullies in Hill Valley, the setting of the film, which looks older or more futuristic due to the change to different time zones. In the future Biffs son and in the past Biffs dad are the troublemakers Marty has to deal with.
In my opinion the movie is one of amazing film works I ever saw. The acting skills of the single characters are wonderful and very satisfying. In addition to that the film effects and the soundtrack is wonderful although the film was made 35 years ago. I like the vibe of the whole movie, which always has a surprise in store. if you want to see for yourself, you absolutely have to watch the film. You will definitely not regret it."
03.07.2021,9.0,"We know the story so I'll save one the usual grief of having to read the plotline over again & again. Fact is, most of us grew up w/it beginning in the 80'S. Watching it in the evening while microwave popcorn was also a ""new thing"". Back to the Future has been a timeless film in my opinion. 1 that even if ya happen to catch it while flipping thru the channels you end up staying w/it. Character development is Supreme, plot is fantastic, comedy is added by a number of characters throughout the entire movie while still keeping just enough forward drama to not forget the point of ""I GOTTA GET BACK TO THE 80's.""
Who, after all....Would want to leave the 80'sðŸ˜Ž"
29.06.2021,8.0,This was my favortie movie when I was a kid and it still is my favortie movie I seen it a lot as a kid it's still a really good movie Michael j fox is a good actor the soundtrack is good too and two and three are good too so if you like theses type of movies you should check it out.
19.06.2021,10.0,I love this trilogy. I was weaned on them in the 1980s and now my kids love them. Can't beat this.
17.06.2021,7.0,"Watched this movie for the first time only a few years back and couldn't believe I'd never watched it before. It's a really good story. So many different characters and scenes, story flows well although the mother/son thing is quite weird. 3rd instalment is my favourite."
13.06.2021,10.0,"Best feature film ever made, imo! The cast, crew, script, music and all are top notch!"
08.06.2021,10.0,"A wonderful movie. Everyone who watched this movie, his fans. One of the classics of cinema. Directed photography. Impressive acting. Everything is wonderful in this masterpiece. I love this movie so much 10/10."
05.06.2021,10.0,1985 movie with such good editing and camera. It's unbelievable.
23.05.2021,8.0,"Such a great movie, great vibes, good story, makes a classic film."
21.05.2021,10.0,An amazing film with an amazing story. Great performances. Definitely worth a watch.
19.05.2021,10.0,It was just a mind-blowing movie I've ever seen.And I'm wondering why I doesn't catch up the place in top places 'cause the settings and also the thought & thinking was beyond imagination from 1985's. None of them now a days make a movie like this. It's a classic sci-fi ever beaten by none.
18.05.2021,10.0,"10 out of 10 is the only option. This movie is a legend and it greatly affected the whole world And even now it doesn't look outdated, or maybe just a little. So if it is not ten, I don't know what movie can deserve such rating."
18.05.2021,8.0,"In retrospect of 80s, with a light convey and future themed movie, this one was understandable to became a hit at that time. The story is intriguing right after the few first minutes and it keeps going until the last minutes. It gave me short of curiosity of what would happen next as if I was in the middle of the scene. Even after watching it more than 30 years after it released, it still amazed me on how this idea coming from 80s. I simply just love this."
15.05.2021,10.0,"A scientist invents a time machine that accidentally sends his young friend back to 1955.This is a classic adventure-comedy with great characters, sci-fi concepts and storytelling. Certain elements require a suspension of disbelief, however it's so enjoyable you get swept along with it.The plot is simple but superbly detailed in how it takes a number of characters through individual arcs and focuses on period details, particularly in emphasising the fish out of water angle of Marty McFly as an 80s kid trapped in his parents era. Practically everything that happens links to something else that occurs at a later point in the story. Whilst doing all of the above it takes us on a highly enjoyable and thrilling adventure.One of its biggest strengths is a sharp script that provides great comedy, lots of cultural references and quotable lines from many characters such as Marty, Doc, George, Lorraine and Biff.This is a movie with a number of memorable scenes such as at Twin Pines Mall, the Enchantment Under The Sea dance and the lightening bolt at the clock tower. In fact, the movie creates an almost living and breathing character out of the fictional town of Hill Valley as we have great scenes in numerous locations such as Lou's Diner, Lyon Estates and Courthouse in different eras.The visuals are brilliant with great cinematography, period detail, costumes and visual effects. The DeLorean car used as the basis for the time machine is an inspired creative idea and is rightfully now a pop culture icon.There is a fantastic soundtrack with a great mixture of original score and pop music. It goes without saying that the general sound mixing and effects are superb.Michael J Fox does a star turn as Marty and effortlessly carries the story with fantastic charisma and performance. He is supported wonderfully by Crispin Glover, Lea Thompson and Thomas F Wilson, who all play memorable characters in both time periods. Christopher Lloyd is a lot of fun as Doc Brown but occasionally strays over the top with a tendency to shout so many lines.The amazing aspect of looking back at it in 2021 is that you now see two past eras depicted."
30.04.2021,10.0,One of the greatest movie in the 80s and if you had not seen this film go and Watch it right now all 3 back to the future movies are amazing and the first one is the best one because of the story and the first back to the future was a masterpiece in my opinion I still Watch that movie every year because it is that great of a movie to watch and it is in my top 3 great movies of all time and if you like Science you will love back to the future and if you are a 80s kid and had not Watch this movie go ahead and watch it it's a classic and this movie alone got me to it got in to movies reviews.
28.04.2021,10.0,"Doc: This is more serious than I thought. Apparently your mother is amorously infatuated with you instead of your father.Marty: Whoa, wait a minute, Doc. Are you trying to tell me that my mother has got the hots for me?Doc: Precisely!Marty: Whoa, this is heavy.Doc: There's that word again: ""heavy."" Why are things so heavy in the future? Is there a problem with the Earth's gravitational pull?Typical dialogue from this great film.Funny end to end.Must watch."
25.04.2021,10.0,"AS A PROFESSIONAL PSYCHOPATH, I AGREE WITH THE FARMER SHOOTING THE GUN AT THE ALIEN MAN. I ALSO LOVE DOC BROWN BECAUSE HE REMINDS ME OF MYSELF. ESPECIALLY THAT ONE TIME I PULLED A BIG BRAIN MOVE ON WALGREEN'S AT 1:03 AM. I PULLED UP IN MY DELOREAN AND BOUGHT A POSTER OF MYSELF. I REALLY WISH MY DELOREAN COULD TIME TRAVEL, THOUGH. I'D GO BACK IN TIME AND STOP MYSELF FROM PLAGIARIZING FINDING NEMO. MAYBE ROSE WOULDN'T HAVE LEFT ME. WHERE WAS DOC WHEN I NEEDED HIM MOST?"
24.04.2021,10.0,"Back to the future... Where do I begin? In the past or the present or the future. I'll start by saying this movie is the best one in the franchise, the second is also good but I have to say this one is the best, one of my favourite time travel comedies, definitely one of those worthy of a rewatch over and over I even went to the cinema for the anniversary such a great film.Michael J. Fox is great in this, luckily he's in all 3 highly recommend!!"
22.04.2021,10.0,"I am a CRAZY fan of these movies (I'm not joking. I have a google slides full of over 1,000 slides of just back to the future behind the scenes pictures). The writing is amazing, acting, plot, everything! The chemistry between all the actors was very good and made the movie flow perfectly. And to be honest, who doesn't want to see a film with Michael J. Fox and Christopher Lloyd in it?!?!"
22.04.2021,10.0,"Is it a perfect movie? I dunno, probably not. But ratings are subjective. It's fun and Christopher Lloyd has been one of my favorite actors since childhood. So it gets a 10."
21.04.2021,10.0,"The best movie ever aired, its a fact. Just pure Greatest the movie is nearly 2hours long and you feel like 1 hour, this movie should be called in another way, because its not even in the same universe than all the others. Maybe its because this movie is from the future.Thank you Mister Zemeckis thank you Mister Spielberg thank YOU mister Michael J fox and Thank YOU mister Christopher Lloyd, you guys are True legend !"
20.04.2021,10.0,"It's been almost 36 years after the release of this movie, and it still keeps being as enjoyable as it surely was back then. A classic no one should ever miss in their life."
10.04.2021,10.0,"At other movie maybe the time machine is like a simple portal, but in this movie they make great model time machine."
07.04.2021,10.0,"The stage curtains open ...I was 16 when ""Back to the Future"" came out. One month after it was released to theaters, ""Teen Wolf"" also hit the big screen. That was a busy summer for Michael J. Fox, who starred in both films. One of my friends had gone to see them both and then reported that ""Teen Wolf"" was the best one of the two. So, I did what he did ... I watched them both as a double feature. After I had watched both films, I wondered what he was on, because ""Back to the Future"" was CLEARLY the best movie. And to this day, it remains one of my all-time favorites.Marty McFly (Fox) is your average 80's teen who dreams of someday making it big as a rock star, has a hot girlfriend, skateboards his way around town, and who has a close friendship with a bit of a madcap scientist named Emmett Brown (Christopher LLoyd), who he affectionately calls Doc. One night, Doc has Marty meet him at the parking lot of a mall where he unveils his latest project ... a DeLorean he has converted into a time machine. During a mishap, Marty is accidentally sent back to the year 1955 where he runs into his parents when they were his age. Now Marty faces the reality of being erased from existence, unless the 1955 Doc Brown can help him get back to the future.I absolutely loved this movie when I first saw it, and I still do today. To say that it is a classic would actually be an understatement, though it truly is. It is the essence of movie magic, and helped to influence countless people, having a large impact on future movies and future lives. It is still just as pertinent today as it was back then. The humor is matched only by it's excitement - and both were abundant. The special effects were great for their time, the cast was strong, and the music memorable.I can't recommend this movie enough. Some people comment on the relationship between Marty and his mother as a teen as being inappropriate - well, if that is all you got out of it, you missed the point completely. ""Back to the Future"" is viable and entertaining, and has its rightful place in the lore of film legends. This is a perfect 10 stars out of 10. If only they made movies like this today."
05.04.2021,8.0,I want to start off by saying I'm not born in the 1980s. But as a early 2000s kid I think this movie is great. It makes this time for movies look so fun and I think it's a really good idea for a story. I love the style and I think it does a good job being funny. Also little side note but I love Marty's sneakers. I highly recommend this movie and would rate it a 8/10.
04.04.2021,10.0,What can i say that hasnt already been said these movies are a work of art def a masterpiece.
02.04.2021,10.0,I LOVE IT. Best movie ever!!!! Michael J. Fox and Christopher Lloyd are perfect!!!!!
30.03.2021,10.0,"""What a great adventure, i really really have a good time with this movie, Michael J. Fox perfomance was amazing, Christopher Llyod was incredible, Alan Silvestri score always give me chills, this movie is amazing, it's very different from any time travel movie i've ever watch, overall Back To The Future for me is not only a movie but a truly great adventure, i highly recommended"""
28.03.2021,10.0,"A masterpiece hands down. Best script, score, casting, and pacing ever put to screen. Be it Truffault or Tarkovsky, nothing beats this. Best movie ever made."
27.03.2021,10.0,36 years after it's release and it still shines like a new penny. I've watched it at least 100 without exaggeration. The fantasy of time travel gets everyone's attention. BtF allows us to believe it and enjoy it at the same time. The cast is magical together to say the least. Another reason BTF keeps drawing attention is because you get to compare the technology that in 1985 was considered futuristic with current technology while looking back at 1950's tech. BtF is truly a masterpiece.
24.03.2021,10.0,Such an honest pure emotion movie in a scifi scale.. This movie. is geniously done.
22.03.2021,10.0,Amazing Movie Of The FutureAmazing Movie Of The FutureAmazing Movie Of The FutureAmazing Movie Of The FutureAmazing Movie Of The FutureAmazing Movie Of The FutureAmazing Movie Of The FutureAmazing Movie Of The FutureAmazing Movie Of The FutureAmazing Movie Of The FutureAmazing Movie Of The FutureAmazing Movie Of The Future
28.02.2021,10.0,"Back to the Future is a masterpiece of a film about time travel, changing the idea of the subject for decades to come.The acting is amazing in this piece of cinematic history. They knew what they were doing when they casted the likes of Micheal J. Fox and Christopher Lloyd as a good young person-old person duo, alongside Lea Thompson, Crispin Glover, Thomas F. Wilson, and Claudia Wells in great supporting roles.The plot, the characters, the comedy, the love, and the amazing special affects helped shape this film into movie everyone should see (if they are into this sort of thing).Bob Gale and Robert Zemeckis knew what they were doing, along with Alan Silvestri's music score for it.10/10."
24.02.2021,9.0,I really like rewatching this. I find it amusing how they pictured us living in today's time. Characters are very believable. There would be some moments though that you'd overthink things and make you wonder the what ifs especially with a time machine. :)
23.02.2021,5.0,"Overrated, as many later movies and shows did take the time travel theme to fascinating lengths, leaving this stuck back in time. I can understand its pioneering qualities, but now it seems dilluted, when put alongside other good works on same general topic. Spielberg had his magic, but after a while, got repetitive. Looking back, it seems clear that he tried to recapture the nostalgia of his childhood, the things those kids dreamt and imagined, which is fine in itself, but gets you only so far. The standard small town, people, relationships (popular kids, loner, bullying, lifelong archenemies) somehow feel museum like today. Without the drop of nostalgia, the movie is more like a framework of childish memories of times that are no longer and feels... Boring. A milestone, but one of a past that isn't connected to our days."
22.02.2021,9.0,"This is my first review for a movie so it is a short one. Yesterday, I watched the movie and I like it so much. The guitar solo scene was awesome. I am an electric guitar player, too. I wish I could play solo like Marty."
22.02.2021,10.0,"An 80's classic that still holds up tremendously well, Back to the Future is iconic from start to finish. This truly is a masterpiece in setup and payoff. Whilst some might find the exposition towards the beginning tiresome, it kept me engaged as I knew that the payoff was coming in the second half. The humour really is second to none, and the characters are genuinely great. They could have ended up being stereotypical, but they ended up working really well. The score is another fantastic element - it's one of the most iconic scores of all time. Michael J Fox is obviously iconic as Marty, and his delivery is really good aswell. The effects mostly hold up well, but they don't need to because of how strong the story is. It really is one of the most simple yet enjoyable films of all time. My only tiny gripe is the final scene with Doc Brown returning and taking them to the future. I think it restricted what they could do in the sequel, and feels quite tacked on and annoying. I know it is an iconic scene, I just don't think it really works at all. Still, this isn't a big enough issue for me to not give this the 5 star rating it thoroughly deserves. It's a truly timeless film (Get it? Because time travel) and I'd definitely recommend it."
19.02.2021,10.0,"What a great movie. With hilarious moments, cool time travel and the fact that no detail goes unnoticed, this is one of the best movies ever made."
19.02.2021,8.0,Back to the future was an amazing film then and it still is to me. A good time travel movie with some good comedy as well.
18.02.2021,8.0,I liked the film however it was unrealistic. That's not how time travel works! But other than that it was a pretty epic gamer movie fam squad!
15.02.2021,10.0,"For me,This is the one of the best movies ever Back the The Future is movie on time traveling. Time traveling has always been exciting and fun.I like the butterfly effect . The plot of the movie is really fun. I Couldn't believe this was a 80s movie."
12.02.2021,8.0,"If I had seen this movie in 1985 when it was released I would have given it 10/10 eyes closed, but since I saw it in 2020's.. one or two things seemed a bit ""mehh""... so giving this an 8/10.Don't be deterred. It's still a great movie and you'll have lots of fun watching!"
09.02.2021,,Back to the future is my favourite film. I really recommend to watch it.
07.02.2021,10.0,"Hey everyone,I just completed watching back to the future trilogy...Im amazed by the fact that this movie was made in 1985 and I just enjoyed it like any other sci fi of our generation. Its a must watch,what a great movie manAnd now I know, where does Rick and Morty comes from...XOXO"
05.02.2021,10.0,"This movie series is an amazing, nail biting, hilarious and fun adventure that you can binge watch! I've watched this one atleast 20 times so it's one of my favourites for sure."
04.02.2021,9.0,This is my all time favourite movie.Better than many present movies.Enjoyable pure classic
