Date,Rating,Reviews
30.03.2018,10.0,"I was flipping channels the other day and ran across BACK TO THE FUTURE, it was just about to start and since I hadn't seen it in quite awhile, I figured I'd catch the first part of it before venturing off to other surfing opportunities. As often happens in this sort of situation, I ended up transfixed by this film and watched the whole thing. After it was over, I asked myself why did I enjoy this film so much and my answer was fascinating (at least to me) -BACK TO THE FUTURE is about as perfect of a film as there is.Why? Let's start with the structure of this film. It follows the classic 3 Act structure. ACT 1: set up the premise, the gimmick (if any) and the stakes. ACT 2: escalate the stakes and throw in complications and obstacles. ACT 3: Resolve everything.Seems like a pretty simple formula, right? So why do so many get it wrong? Quite simply, they don't keep it simple and then execute (almost to perfection) the simplicity of the structure. Let's break down the 3 Acts of BACK TO THE FUTURE.ACT 1 - set up the premise, the gimmick and the stakes. The premise & gimmick is simple, time travel is possible and our hero travels back in time and is stranded there. The stakes are even simpler - our hero must find a way to get Back to the Future.ACT 2 - escalate the stakes and throw in complicaitons and obstacles. The stakes are escalated by the fact that our hero interrupts the timeline of when his mother met his father, thus there is the very real possibility that he will cease to exist for his parents never met. Our hero must find a way to bring his mother and father together. The complications are that his parents are not the boring old fuddy-duddy's that our hero thought they were, his father is a peeping-Tom nerd and his mother is a randy high-schooler who falls in love (lust?) with our hero, her son. Further complicating things is that the time machine must find enough power to make the time travel device (the flux-capacitor!) work, power that is not readily available in this timeline. Adding one more complication to the mix is the school bully who is constantly after our hero.ACT 3 - resolve everything. This is where this film excels. EVERY loose end is tied up. Our hero find a way to reunite his mother and father, the bully is put in his place, a source of energy is found and our hero's journey comes to a succesful conclusion.There is much, much more to this film than those plot points, but I just wanted to show how deceptively simple and efficient this plot is. Kudo's must go out to screenwriter's Robert Zemeckis (more on him later) and Bob Gale for coming up with this idea and executing it so well. Gale (1941, KOLCHAK: THE NIGHT STALKER) said he came up with this idea when he saw his father's high school yearbook and dreamed about going back to meet him. He stated that he doubted that he and his father would have been friends.An interesting side fact: The University of Southern California Film school's writing classes use the screenplay for Back to the Future as the model of ""The Perfect Screenplay"". So, I rest my case.But a ""perfect"" screenplay would be worthless without near perfect execution of putting the words and actions up on the screen - and this film achieves that as well. Director (and co-screenwriter) Robert Zemeckis (WHO FRAMED ROGER RABBIT, FORREST GUMP) cleary had a vision of how to make this film and did not waiver from it. The action is strong, the fluidness of the film is solid and the performances are all top-notch. The only thing that might knock this film down a peg or two is some of the 32 ""special effects"" shots that - to look at it these days - seem somewhat archaic (see the flames between Doc Brown's and Marty's feet when the DeLorean first goes forward in time). But for the time, these special effects are state-of-the-art.Speaking of performances, Michael J. Fox became a movie star with this film, and rightfully so. His Marty McFly is charming, quirky, intelligent, dorky - all at the same time. His uncomfortableness with his teen age mother is palatable. Credit must go with Director Zemeckis, who - after he couldn't get Fox released from his contract on the TV show FAMILY TIES - went (famously) with his 2nd choice, Eric Stoltz. When Stolt's seriousness and ""method"" acting was not meshing with the type of film he wanted to make, Zemeckis made the bold decision to fire Stoltz and worked out a deal where he can use Fox at night while Fox shot Family ties during the day. Playing against Fox, brilliantly, is Christopher Lloyd as ""Doc"" Emmit Brown. A two-time Emmy winner (at the time) for playing crazy Jim Ignatowski on the TV show TAXI, Lloyd played Doc Brown as ""part Einstein, part composer Leopold Stokowski"", creating what would be the benchmark for ""brilliant, scatter-brained scientist"". Leah Thompson does the finest performance of her career as Marty's mother and Crispin Glover was beyond quirky as Marty's nerd/loser Dad. Finally Thomas F. Wilson is the embodiment of bully as ""Biff"" Tannen.After the success of this film, two other BACK TO THE FUTURE films were made - films that I feel were good, but somewhat diluted the perfection of this film. No matter. Sit down, relax and enjoy one of the most ""perfect"" films ever made.Letter Grade: A+A rare 10 (out of 10) stars and you can take that to the Bank(ofMarquis)"
27.03.2018,9.0,"I love this movie, I watched all three and i will watch it over and over."
20.03.2018,10.0,BTF is the most creative movie ever. It strongly deserves to be on the top of the list. This gripping mixed sci-fi comedy movie enshrined in it's cast and scenario.
15.03.2018,10.0,One of the best classics. This movie never gets old. Genius.
28.02.2018,10.0,"Sci-fi aficionado? Look no further! This movie is ""heavy"" stuff! :)"
13.02.2018,9.0,"This is overall a very funny and entertaining classic that can be enjoyed by most everyone. There are many plot conveniences, but luckily none of them are a result of characters being stupid. Though not all of the characters are intelligent, they're not too dumb to breathe. The characters that are dumb aren't unrealistically so. All the actors' performances are very good. Most of the jokes are pretty clever, and there are a lot of consistencies within the movie's world that other movies wouldn't have. This movie is kind to people who like to use their brains. Even though the effects are old, they're still pretty good and unlike the music I wouldn't describe them as cheesy. The plot is entertaining and easy to follow."
13.02.2018,10.0,"For over 3 decades millions of people enjoyed this incredible trilogy. The film is about Time travel and it's truly TIMELESS, for very simple reason: people loved it back in 80s, they love it today and will love it for many generations to come!!!"
04.02.2018,10.0,This is such a great movie !! I love it sooo much:)
22.01.2018,10.0,"At first, I want to say that I LOVE the BTTF trilogy. It has humour, action, romance and ofcourse science fiction. And Back to the Future itself is my favorite movie ever. But is actually also the best movie ever. It has everything. Especially the chemistry between Michael J. Fox and Christopher Lloyd is brilliant. 10/10"
15.01.2018,10.0,Back to the future is one of the stories that you never forget! Its so amazing... There is bad comment only good things to say. The cast is awesome! The story! Its doesnt age! Its one of the sequel that I will always have in mind even in 50 years from now!
14.01.2018,8.0,"Back to the Future is a movie about Marty McFly and his crazy scientist friend Dr Emmet Brown and they go on a crazy time traveling adventure as they travel to the past and mess with the outcome of the future and have to rush to fix it before they alter time. Michael J. Fox is Marty McFly your average teenage boy who gets thrust into an adventure which would open his eyes to the past. Christopher Lloyd is the crazy scientist Emmet Brown who uses a delorean as the shell of a time machine. there are supporting actors like Lea 
Thompson,Crispin Glover they are the main supporting cast so overall its a solid cast of great actors who master there roles. I love back to the future it is one of my favorite movies of all time and it has earned that because i think it's popularity it became a instant classic and it's so re watchable that any one can watch it and for that it's earned that position."
05.01.2018,9.0,This movie has a special place in my life. I've watched it with many different pairs of people and no matter what it's always a great time. An all time favorite for me. Back to the Future II tops it with their flash backs to the first film. Such an amazing story that inspired me to become a filmmaker!
31.12.2017,10.0,Hilarious ROFLMAOff guitar riffs - bu duh main thing that gets me is HOW can that aluminum delorian keeps it's NON-dented shape after crashing into a barn + BLOWING straw dust thru the roof ? + what wuz Marty waitin for - the AIR BRAKES ?? ++ wutta gorgeous pretty cute little girl (Narty's aunt) sitting at the table watching TV -so adorable
26.12.2017,10.0,"There are some films that are just timeless and everyone should watch (especially in today's climate of remakes, reboots and reimaginings). Basically, see it before it gets horribly remade with overblown computer effects and wafer-thin characters that you simply just don't care about. By now, you can probably already tell that I love this film and I'm effectively going to 'gush' about it, so if you just want to accept now that it's a definite 10/10 you might as well stop reading now. However, if you're vaguely interested as to why I think it's so - technically - perfect, then feel free to read on. In case you're one of the few people that have been living in 1955 all your life and have only just arrived in our year courtesy of a time machine, you may need to know that 'Back to the Future' is about time travelling. Marty McFly, played by the ever youthful Michael J Fox, gets caught up in eccentric inventor, Doc Brown's, latest scheme to build a time machine out of a DeLorean car. Naturally, things don't go smoothly as he inadvertently ends up in 1955 and accidentally interferes with the very moment his parents got together, therefore possibly preventing him from every being conceived. If this wasn't bad enough, he's only got a one-shot chance at returning to his own time thanks to a lightning bolt due to power his time machine for the return trip.I think what makes this film stand the tests of time is the fact that it is a true 'family' film. Whereas most films which can be watched by children are largely aimed ONLY at them and force the adults to sit through it until it's over, I can't imagine anyone - male/female, young/old - not actually finding enjoyment out of this adventure. It's funny without ever being childish or vulgar, exciting without ever being over the top or unrealistic (if you're willing to suspend your disbelief enough to believe that time travel is actually possible) and, of course, it contains some of the most memorable characters ever committed to film. Naturally, our dashing young hero, Marty, is very easy to root for, however it's his cranky old sidekick 'Doc', played perfectly by Christopher Lloyd who steals every scene and is the true joy to watch all the way through. It's also worth mentioning that Marty's on-screen family also can hold their own, played different versions of themselves throughout the time periods, but special mention should go a character who should - by rights - be little more than a stereotypical bully, yet 'Biff' somehow becomes the clichÃ©d bully that all other on-screen thugs aspire to be ever after. If this film has a downside - and I'm only mentioning this because I can see that some people may have a problem with it these days (I didn't and still don't!) it's that there are a few topics of humour that some people may find a little 'edgy' in today's PC culture. For some reason I get the feeling that today any 'family' movie may shy away from a mother inadvertently falling in love with her son, but it was the eighties and things were different then!There aren't many movies that still can bring a family together around the TV in the living room on Christmas Day, but this is still one of them. If you haven't already brought the entire trilogy on DVD, then watch it now and show your children. It deserves to entertain future generations. Yes, the following two 'Back to the Future' movies weren't quite so well-received by the critics, but I think they're great, too."
20.12.2017,10.0,There are a few movies that are so perfect that I hope they never remade. This is one of them...One of the greatest movies ever in my opinion. It's so well thought out and put together. A true cult classic and masterpiece.
13.12.2017,10.0,This is one of those movies you just can't hate. It's just a classic from the 80s that just amazing no matter how many times you watch it. 10/10
03.12.2017,10.0,"When you browse a catalog of films (online or otherwise), the titles are usually arranged according to genre, such as drama, action, comedy, romance, etc. When it comes to Back To The Future, a copy would need to be put in almost every category, as it is perhaps the only film I have ever seen that almost completely defies the very notion of genre. That reason, among others, is why I consider this to be the finest film ever made.The basic story revolves around 1980s teen Marty McFly (Michael J. Fox) whose friendship with mad scientist ""Doc"" Brown (Christopher Lloyd) ends up with Marty in a time machine--made out of a Delorean!--whisked away to the year 1955, where he ""messes with the space-time continuum"" and must make sure that his parents meet and fall in love once again, thus assuring his own existence.That relatively simple concept contains so, so much more in terms of overall entertainment. It is hilarious, romantic, dramatic, and full of action and adventure in equal measure. The acting is also some of the best that cinema has to offer. While Fox and Lloyd are now iconic as the leads, the trio of Lea Thompson (playing Lorraine Baines), Crispin Glover (George McFly), and Thomas F. Wilson (Biff Tannen) almost steal the show on certain occasions with their various personalities. Even the ""bit players"" are superb in their short, yet very important/meaningful appearances.Perhaps the most impressive thing about this entire film experience, though, is the detail put into each and every scene. One must pay close attention to every single detail (no matter how small or seemingly inane) of every single scene in the 1980s-portion of the film in order to better understand the jokes and sight gags of the 1950s-era time frame. I have watched this film at least a dozen or more times all the way through, yet on each viewing I find something new that I seemed to have missed.Finally, the screenplay from ""the Bob's"" (Zemeckis & Gale) is perfect. I say that without hyperbole. There is simply not a wasted line or scene in the entire picture. Everything has meaning in some way, shape, or form that is paid off further down the road.Whenever I watch ""Back To The Future"", its roughly 2-hour runtime seems to absolutely fly by. It is so perfectly paced, with each scene expertly transitioning into the next, that there's never an iota of chance you'll be taken out of the experience in any way. It is the very best that cinema has to offer on all fronts."
28.11.2017,10.0,"Parents need to know that Back to the Future is a family time-travel favorite that includes sequences that place the hero and his friends in physical jeopardy: an attack in which a sympathetic character is thought to be killed, a van chasing a teen on a skateboard, several episodes of bullying, and more. The violence is exaggerated and closer in tone to cartoon jeopardy than real danger, but some kids will no doubt find it tense. Several scenes show the hero's discomfort when the girl who will eventually be his mother tries to entice him with kisses and embraces; there's also a scene in which the beginnings of an assault on a high school girl are shown; she struggles/expresses fear, but intervention prevents anything else from happening."
05.11.2017,10.0,"Having watched this movie for the first time, as a 25 year old, I was uncertain whether I'd actually enjoy this movie due to 1- My age, and 2 - The age of the movie...I needn't have worried!The movie holds up well in terms of special effects, which I was not expecting.The story is exciting and fun, the cast is brilliant and this is an all round great family movie - possibly the best!10/10. It's got everything!"
02.10.2017,8.0,"One of the most Popular Movies of all Time. It is a Safe, Feel-Good Family Entertainment from Spielberg's Sublime ""Suburban"" Playground of Hits. It's the Backdrop the Master Manipulator Finds His Mega-Money-Makers the most Often.Robert Zemeckis was Hired to Direct based on His often Rejected Script (with Bob Gale) that Spielberg recognized as something Special.And Special it Turned Out to be. It has a Great Cast of Comedic Talent (Michael J. Fox, Christopher Lloyd, and Crispin Glover) feeling right at Home with the Story, and some Nifty State of the Art SFX.The Movie is a Slick Fun Time with all the Elements coming Together to make it an Ensemble Piece of Family Fodder that Charms with a Fast Pace, a bit of ""Fish Out of Water"" Edginess. Lea Thompson's Endearing Turn as Marty McFly's Mother is Great, but Nothing here will ever be Considered High-Art. Just a Clap-Trap Pleaser (Spielberg's Specialty) with High Commercial Value.The Product Placements are Over the Top.But the Many Pop Cultural References from the 80's and the 50's Assured, at the Time, that a Parent and Child from 1985 (the Heart of the Movie), can Enjoy this one Together, Dare it be Said, Into the Future."
21.09.2017,,"The thing that is GREAT about this movie is the adventure, and imagination. The only thing that I dislike about the movie is the swearing. The greatest time travel movie ever! A classic, can not be remade. Anybody, including YOU, will love it! I recommend this movie to anybody."
30.08.2017,10.0,"This movie is just too perfectly executed, and will always remain to be my favorite. There's too many good things to say about it. You just need to watch it, at least once in your life. All scenes of the movie are great, especially that Earth Angel scene. If you watched a lot of 80's movies, and this isn't one of them, whatever you do watch this, you will not be disappointed."
11.08.2017,9.0,"A great film which not only entertains but also makes you think, that is this possible? what if it is? but surely it cannot? such questions when come to your ind, you surely know its a beautiful film. All the series of this film are good. Characters are limited, story is simple and plot is awesome."
05.08.2017,2.0,"This is a time-travel adventure comedy film, set in California, starring Michael J. Fox. BTTF has a reputation as 'a film that's impossible to dislike'. We're supposed to ignore (or not notice) the plot holes and inconsistencies. I disliked this film when I watched it during my teens - and even more when I watched it during my twenties. I can't see how any adult can enjoy this childish nonsense."
14.07.2017,9.0,"Back To The Future is a perfect example of a film that gets better the more I watch it. With time travel, great characters and fantastic comedy it is no wonder it is considered a classic. Michael J. Fox plays fish out of water Marty Mc Fly perfectly when he is taken back to the year 1955 through Doc Brown's unorthodox time machine. Despite some unusual situations the film is able to keep a whimsical charm that many Spielberg produced films from the era possessed. Not to mention great direction from Robert Zemeckis who simultaneously captures the spirit of the 1980's through the character of Marty McFly as well as perfectly replicating the feel of the 1950s in the setting. While it can not be ignored the plot holes that would be apparent in any film involving travel to the past the film is such an enjoyable experience that I did not question it. With universal appeal to both children and adults through its clever humor and originality this will definitely be a classic for a long time to come. I would urge anyone that loves film that has not seen Back To The Future to seek it out immediately."
29.06.2017,8.0,"this movie is quite entertaining with all funny stuff in it. Michael J. Fox and Christopher Llyod gave the audience a lot of comedy and little action pack (just a little not quite big) and they are work very good to bring the character up into that story as well. For me, that I didn't forget is an iconic theme song always ringing my ear, and that's remind me how funny is this movie and fun to watch!"
28.06.2017,10.0,"I love Back to the Future. While having a typical 80s feel to it, which I like, I love how fun, irresistible and original the film is. The special effects are dazzling and the comedy is suitably sly and sophisticated. Helping along the way is a script that is pretty ingenious, the sort of script that has quotable lines and also pokes fun at 1950s icons and lifestyles during the frequent bouts of time traveling. The score by Alan Silvestri elevates the sense of fun to a greater level, the main theme is one of the most memorable themes ever in the history of film, or so I think anyway. Robert Zemekis's direction is very good, and the cinematography, scenery and costumes are also excellent. And I have to mention the acting, Michael J Fox is really appealing in the role of Marty McFly, the role that propelled him to stardom, and Christopher Lloyd is brilliant in one of his most memorable roles(and yes this includes Judge Doom from Who Framed Roger Rabbit? and Professor Plum from Clue). Lea Thompson and Crispin Glover are also great. Overall, brilliant film that is good in so many ways."
14.06.2017,7.0,"Back to the Future was a Movie which showed that time traveling was possible. In late 1985 they still made a pretty good Sci-Fi movie with some comedy, This movie was one of the best at its time and due to with other parts of the movies were also made,Converting a Car into a time Machine was pretty good idea and the Model of the Car was also best due to its time. love to watch again"
09.06.2017,6.0,SOME SPOILERS IN THIS ARTICLE this is a great movie about a boy that takes a time traveling car to the time his parents were sophomores and convinces them to dance together and that leads to them getting married and he saves himself from never getting born
29.05.2017,8.0,"BACK TO THE FUTURE (1985) **** Michael J. Fox, Christopher Lloyd, Lea Thompson, Crispin Glover, Thomas F. Wilson, Marc McClure, Wendy Jo Sperber. This generation's ""It's a Wonderful Life""? Think about it. Very popular and very entertaining sci-fi comedy that made Fox a movie star after success with TV's ""Family Ties"", casting him, after Eric Stoltz was dropped, as Marty McFly who winds up in a nuclear-powered DeLorean time-machine and is sent back in time to 1955 by his quintessentially eccentric friend Dr. Emmet Brown (Lloyd doing a fine Art Carney). There he meets up with his parents to be and realizes his chance encounters have changed his future and he must see history repeat itself or perish. High-concept hilarity and some truly ingenious schematics thanks to screenwriter Bob Gale and director Bob Zemeckis. Wondering what it would be like to never be born and/or what it would be like if things were different...see what I mean. Oscar- nominated song ""The Power of Love"" by Huey Lewis (who has a fun cameo) fuels this dynamo gem of a film. Classic.Also Dean Cundey as DP was fantastic! I saw his latest movie, 'Slamma Jamma' - just amazing DP!"
30.04.2017,10.0,"Time travel movies are always intriguing and make the audience wonder, would I ever visit the future or go back in time? This movie brings you into to the world of 'what could happen if someone really DID invent a time machine'. Michael J. Fox plays Marty McFly who is a teen who gets into trouble and needs the help of Doc Brown, played by Christopher Lloyd. It's campy, hilarious, suspenseful, and fun. A must watch for fans of time travel movies!"
28.04.2017,10.0,Back to The Future was made a great Success by Mendocino California'sLocal Resident: Christopher Lloyd. He lives and resided in Mendocino for years and years and was/ is an very amazing and friendly Local. he would get coffee every morning at one of the local coffe shops.. It was so amzaing and fun to see him.
