"Content","Date","Consumer Sentiment Classifier","Automatic Classifier"
"Excellente expérience.J’ai d’abord fait l’achat d’un premier véhicule, et après quelque temps j’en avais trouvé un autre qui me convenait mieux, j’ai donc pu annuler par l’achat avec une grande facilité. J’ai donc acheté un autre véhicule sur le site que je ne regrette pas du tout. Un commercial est disponible tout au long de la vente pour répondre à toutes nos questions, bien que les descriptifs soient très détaillés. Le véhicule reçu est identique à l’annonce, pas de mauvaises surprises. Je suis ravie de mon expérience chez autohero, que je recommande sans hésiter et chez qui je reviendrais certainement ! Un grand merci également au commercial Onel.","2023-11-23T23:03:11.0000000Z","Positive","Satisfaction with Purchase"
"Autohero m'a vendu un véhicule avec écrous antivol sur les roues sans préciser que la clé pour les écrous n'était pas fournie avec le véhicule. Résultat: impossible de dévisser les écrous, il faut percer ! Plusieurs centaines d'euros pour une simple crevaison, Autohero ne prend rien en charge car 2 ans ont passé depuis l'achat.","2023-11-22T18:52:53.0000000Z","Negative","After-Sales Service"
"N'étant pas satisfait du produit et l'ayant fait savoir rapidement le 16/11 exactement, Service retour produit déplorable ayant 21 jours de rétractation et 500kms si on dépasse il y a un forfait kilométrique de 0.50cts par km non mais sérieusement ? le service retour viens à peine de me contacter pour prendre un rdv de retour du véhicule prévu le 28/11 pas avant...je me demande s'ils ne font pas exprès de ne pas avoir de date de retour rapidement pour faire trainer les choses... attention ou vous mettez les pieds avant d'acheter sur le site !!","2023-11-21T18:05:28.0000000Z","Negative","None"
"J'avais un doute à l'achat d'un véhicule sur internet j'ai passé le pas avec Autohero et je suis très content de mon expérience un grand merci à Stephen pour sont professionnalisme et aussi ça gentillesse lors des appels téléphoniques au SAV une équipe au TOP !!!!! A Bientôt pour un second achat","2023-11-20T19:36:24.0000000Z","Positive","Professionalism"
"J'ai hésité avant d'acheter une voiture en ligne, mais tout s'est finalement bien passé. Elle a été livrée moins de 2 semaines après la commande, en parfait état. J'ai vérifié les options renseignées sur la fiche AutoHero et j'ai constaté qu'il manquait le limiteur de vitesse et l'aide au maintien dans la voie. Je l'ai signalé à Autohero (réclamation sur leur site) et ils m'ont fait un geste commercial.Je n'hésiterai pas à recommencer l'expérience si je change de voiture un jour.","2023-11-20T16:48:17.0000000Z","Positive","Online Buying Experience"
"Je ne connaissais pas Autohero donc je suis allé voir les commentaires des clients qui étaient tous positifs. Ceux si m ont mis en confiance pour acheter une Toyota yaris hybride et je suis très satisfait de la société Autohero bien entendu que tout le personnel reflète au sérieux de l enseigne.Si j ai besoin d un autre véhicule, sans hésiter je la prendrais chez Autohero . Pour le règlement j ai donné un chèque certifié de banque à la livraison de ce véhicule .Merci et bravo pour cette société.","2023-11-18T10:25:36.0000000Z","Positive","Satisfaction with Purchase"
"Par le biais d’un ami j’ai acheté ma voiture une Peugeot 308 vraiment j’ai rien à dire. Rdv de livraison respecter le livreur MR SHARIF dé AUTOHERO est vraiment un professionnel. Je remercie tout le staffe et je vais en profiter de ma belle voiture 😂😂. Merci 🙏 AUTOHERO pour l’aide à mon financement. Je conseille vivement à AUTOHERO","2023-11-18T09:03:47.0000000Z","Positive","Satisfaction with Purchase"
"Nous étions à la recherche d’un deuxième véhicule vu que notre famille s’est agrandit et ayant de très mauvaise expérience avec les voiture d’occasion chez les particuliers ou même dans les garage traditionnel , j’ai trouvé le site Autohero et ayant consulté les avis sur Trustpilot nous avons décidé de nous lancer Je ne vous cache pas qu’investir une somme importante fait peur mais les conseillers clientèle vous met en confiance et même les garanties  proposées sur le site vous donne confiance D’abord merci à Stéphane qui a essayé de trouver des solutions avec moi pour le refus de paiement en plusieurs fois par leur partenaire . Il a été de bon conseil et très sympa Un peu de retard sur la livraison mais rien de bien grave j’ai été tenu au courant de chaque étape par une superbe conseillère mais malheureusement je ne me souviens pas qu’elle m’est dit son nom Voiture bien préparé à la livraison au top J’ai eu un soucis avec les numéros de plaque qui n’était pas les même à l’avant et à l’arrière juste une petite erreur sur une lettre et après avoir fait une réclamation sur le site le conseiller Jean m’a contacté très rapidement pour que j’aille les changer dans un garage à leur frais Jean a été très réactif et très sympa du début à la fin Merci à vous tous pour votre professionnalisme Je suis très contente d’avoir acheté une voiture sans pour autant stressé de m’être fait arnaquer comme à chaque fois que j’en ai acheté une","2023-11-17T20:40:27.0000000Z","Positive","Online Buying Experience"
"Près d'un an après avoir acheté mon véhicule via Autohero, on m'indique que la courroie de distribution devait être remplacée. Toutes les réparations ont été prises en charge par la garantie Autohero.Le SAV a été très efficace, en particulier Gaël avec qui la communication a été simple et professionnelle.","2023-11-17T16:06:31.0000000Z","Positive","After-Sales Service"
"Autohero m'a vendu une voiture avec un moteur 1,2 pure tech qui a un soucis .ils ont changé la courroie de distribution à 39000 km qui aurai pu m alerter mais le pire c'est qui me l'ont vendu plus de 15000 euros et quand je me suis aperçu du problème moteur ils m ont fait une proposition de reprise 10 mois plus tard de 9800€ .A vous de juger","2023-11-16T20:40:09.0000000Z","Negative","Vehicle Condition"
"J'ai cherché sur le site un véhicule qui conviendrait à notre association. Dès que j'ai contacté Autohero j'ai bien été prise en charge. Le commercial a répondu à toutes mes questions.  La transaction s'est très bien passée ainsi que la livraison. J'ai fait appel à Autohero car en 2022 j'avais acheté mon véhicule personnel  et j'en suis contente. Je ferai de nouveau appel à Autohero pour l'achat d'un deuxième véhicule pour notre association !","2023-11-16T09:45:35.0000000Z","Positive","N/A"
"A part 2 retards dans la livraison dont un imputable a la tempête rien, a redire.Processus d'achat hyper simple.Livraison très pro de la part de Didier.Reprise très rapide. Attention pour cette dernière il y a un délais d'une heure le temps que le livreur vérifie le véhicule a reprendre. Ils ne le précisent pas durant le processus d'achat","2023-11-15T14:03:26.0000000Z","Negative","Delivery Experience"
"J'ai acheté une voiture fin septembre 2023,j'ai adoré leur site, la présentation est précise et les défauts sont bien montrés, des zooms sont possibles pour bien les voir. Le service client est rapide dès que l'on souhaite les joindre. En cas d'erreur de leur part, ils vous remboursent une certaine somme en fonction du problème. Exemple, ils avaient mis dans le descriptif que la voiture possédait un lecteur CD, alors que non, ils m'ont remboursé 200 euros. La voiture est vraiment comme décrite, et prête à rouler. Le seul problème est que mon département n'était pas couvert par leur livraison, j'ai du me déplacer à 1 heure de chez moi pour récupérer mon véhicule dans un centre partenaire, d'ailleurs reçu par une personne très pro. Franchement je vous les conseils. Si besoin je n'hésiterai pas à refaire affaire avec eux.","2023-11-11T13:14:58.0000000Z","Positive","N/A"
"Pour la commande tout ce passe bien . Par contre le SAV est très clairement à fuir . J’ai rencontré un soucis plutôt grave sur ma voiture . Ils m’ont baladé de garage en garage ( car oui les SAV se font uniquement dans des garages du style norauto..etc sinon c’est vous qui payer le diagnostic..)Après diag à ma charge , ils prennent en charge une partie de la réparation ( Vanne EGR ) Cependant d’autre problème apparaissent et ils refusent toute prise en charge en se cachant derrière leur politique  ( radiateur de turbo 1300€ de réparation , chauffage … ) . Une procédure judiciaire est en cours avec eux , ils n’ont répondu à aucunes lettres recommandé d’expert… Le meilleur pour la fin , la voiture après enquête de me experts , a eu un gros sinistre dans le passé suite à un accident … Bref je ne recommande pas cette société , ou alors n’ayez aucuns problèmes majeur .","2023-11-09T15:21:13.0000000Z","Negative","After-Sales Service"
"Service client joignable très facilement par téléphone. Aucune mauvaise surprise car le dossier photo est exhaustif (même concernant les imperfections). Pièces d’usure changées pour la vente.Livraison très rapide et à domicile avec moult explications de la part du livreur.Enfin et c’est le plus important: le véhicule livré est impeccable, lustré dedans comme dehors presque comme neuf!","2023-11-09T10:19:36.0000000Z","Positive","Vehicle Condition"
"J'ai eu pour ma part quelques soucis, dès les premiers jours j'ai eu le voyant moteur qui s'allumer donc direction le garagiste . Résultat environ 1000 € de réparation, autohero à vite pris en charge les dépenses malgré  le fait que ce ne soit pas un garage agréé par eux. Merci encore à Gael","2023-11-08T16:15:11.0000000Z","Positive","After-Sales Service"
"Me voilà très satisfaite de mon achat chez autohero.  Que ce soit pour un premier contact pour info avant achat puis tout le suivi de l'achat jusqu'à la livraison,  service au top. Service client à l'écoute et rassurant, et le livreur au top, pleins de conseils utiles. Un grand merci et je recommande à 200% autohero.","2023-11-08T12:15:07.0000000Z","Positive","Satisfaction with Purchase"
"Très satisfaite service client disponible et professionnel véhicule conforme à la description livraison à domicile très satisfaite par le livreur Laurent très agréable professionnel et disponible pour fournir toutes les explications et justificatifs du véhicule je recommande vivement et pour ma part premier achat en ligne et pour le moment que du positif","2023-11-07T13:51:56.0000000Z","Positive","Satisfaction with Purchase"
"Six mois après avoir acheté un véhicule chez Autohéro, je suis pleinement satisfait à bien des niveaux. J'ai lu beaucoup d'avis sur internet avant de me décider à acheter un véhicule en ligne chez Autohéro. Ce sont des sommes d'argent pas négligeables, et on est jamais sûre de la fiabilité du commerçant. Alors je donne mon avis pour ceux qui seraient dans la même situation que moi à l'époque (mai 2023).- Tout d'abord les processus de commande, de livraison et de reprise de l'ancien véhicule sont efficaces et les agents sont à l'écoute et aidant. C'est particulièrement appréciable, surtout quand on va dépenser une somme d'argent importante pour un achat en ligne d'un véhicule que l'on a pas vu en vrai.- Mais c'est surtout les échanges avec le SAV (Interlocuteur Gaël du service après-vente) qui m'ont donnés pleine satisfaction. En effet, il se trouve que le véhicule que j'ai acheté avait un défaut très coûteux à réparer (Il ne fait aucun doute que AUTOHERO n'était pas au courant de ce défaut à la vente du véhicule). Après de demande de devis au garage et validation par le SAV, toutes les réparations ont été effectuées et payées par Autohero (plusieurs milliers d'euros) en plein accord avec la Garantie Premium de 12 mois.En conclusion, je recommande fortement ce concessionnaire en ligne, pour l'entièreté du processus et pour le professionnalisme du SAV. Meme si comme dans mon cas, il y a un problème inattendu sur le véhicule d'occasion (on est jamais à l'abri), le SAV fait tout ce qu'il faut pour régler le problème le plus rapidement possible. Et ça c'est particulièrement appréciable, faisant de moi un client satisfait. NB: Par ailleurs, je recommande aussi de contacter l'assurance premium sur les 12 mois de garantie.","2023-11-07T11:26:01.0000000Z","Positive","Purchase Process"
"Je suis toujours dans l’euphorie, l’excitation!J’ai reçu mon véhicule aujourd’hui. Et franchement! Je ne regrette pas mon achat en ligne chez Autohero. Service commercial à la hauteur, de ce qu’on attends. Tjrs à l’écoute et réponds au besoin de ses clients. Service de qualité, livreur très professionnel et souriant. Remise de véhicule super propre comme sortie d’un concessionnaire! Et les photos lors de l'achat en ligne, est exactement comme sur le site! Voir en mieux de visu. Remise de documents en règles, avec la possibilité de contacter le service-client à la moindre question. Livraison rapide, avec le plus grand soin! J’aurai tant à dire! Mais une chose est certaine, c’est que je recommande fortement cette entreprise se faisant connaître de plus en plus! Pour ma part, c’est Noël avant l’heure! Merci grandement Autohero.","2023-11-06T23:20:19.0000000Z","Positive","Satisfaction with Purchase"
"Très satisfait. Véhicule conforme à la description voir mieux. Très bon suivi commercial et livraison sans problème.Dommage que la livraison passée il n'y ait plus aucun retour.- La batterie affichant 11,4V je l'ai débranchée et mise en charge trois jours après la réception du véhicule. Pas de carnet d'entretien, donc pas de code pour media Nav. Ma demande du code à Autohéro est toujours sans réponse.- Dés décembre et les premiers froids impossible de démarrer le matin, d'où achat d'une batterie neuve.La batterie est certes une pièce d'usure mais livrer un véhicule avec une batterie de 6 ans qui ne tient plus la charge est décevant.","2023-12-30T10:59:28.0000000Z","Positive","None"
"Je recommande tout à fait Auto Hero à quiconque souhaite s'acheter une voiture ! Ils font preuve d'une bonne organisation et de professionnalisme. La livraison s'est déroulée comme prévue, et la voiture était dans l'état annoncé, c'est-à-dire en très bon état. Je les remercie et ne regrette pas de leur avoir fait confiance !","2023-11-03T14:33:17.0000000Z","Positive","Satisfaction with Purchase"
"Très bonne expérience avec Autohero, j'ai trouvé le véhicule de mes rêves avec un prix moins cher qu'ailleurs. Même si on ne peut pas voir le véhicule sur place avant d'acheter, l'annonce et les photos sont très fournies et précises avec tout l'historique d'entretien. Après le virement fait, la voiture m'a été livrée dans la semaine ! Et le fait d'avoir 21 jours et 500km pour tester et rendre la voiture en cas de doute est un luxe dans le marché d'occasion. Pour finir, la livraison dans le camion transparent a fait son petit effet ! Je recommande","2023-11-03T14:23:21.0000000Z","Positive","Online Buying Experience"
"1 étoile car 0 étoile n'étant pas possible ! car je suis victime de pratique commerciale très douteuse.A 2 jours de la livraison de la reprise de mon ancien véhicule et la livraison du nouveau, Autohero tente de me racketter. On m'annonce que subitement le prix de rachat de mon ancien véhicule baisse de 31% (6093 € à 4200 €) alors que le même modèle, même année, même kilométrage est vendu entre 7500€ et 9500€ sur le site Autohero !!! Ensuite on m'impose de régler la différence, quelle honte !!!Ni le commercial, ni le directeur commercial ne m'ont apporté de réponse satisfaisante à part un cours de bégaiement incroyable !!!!Je déconseille vivement ce marchand en ligne car il ne respecte pas les promesses clients, les contrat signés et validés, ni même les factures !!! Par contre aucun délai pour encaisser mon virement pour programmer la livraison mais pour me rembourser, on m'annonce des délais bancaire....Bref, une belle arnaque !","2023-11-02T20:48:45.0000000Z","Negative","After-Sales Service"
"Je me suis présentée pour récupérer la voiture commandée.Livraison à 1h de chez moi engageant donc des frais de déplacement justifiés si le véhicule n'avait pas présenté un bruit mécanique dès la sortie d'essai. compte tenu des soit-disant contrôles qualités inadmissible!en toute logique j'ai refusé le véhicule.j'ai donc assuré un véhicule, demandé un chèque de banque, payé des frais aller et retour. on me propose un avoir de 130€(frais engagés) pour un prochain véhicule alors qu'un bruit mécanique n'a pas été détecté par les ""experts"". Une blague","2023-11-02T11:29:12.0000000Z","Negative","Delivery Experience"
"Bonjour,Véhicule commandé le 09/10/23, livré le 24/10/23 avec reprise de véhicule à l'agence de Tours, la reprise s'est bien passée, la livraison conforme en apparence, même si le véhicule manquait un peu de propreté et que je n'ai pas eu droit à une présentation du véhicule.Le réel problème est apparu après lors de mon premier trajet pour ramener le véhicule à mon domicile, véhicule qui se met à trembler dès qu'on freine à plus de 60 km/h, j'ai fait un essai routier avec un garage qui m'indique que les disques avant sont voilés.J'ai donc contacté autohero pour une prise en charge et là c'est devenu une galère, car malgré le diagnostic du garage, ils me demandent que le garagiste se filme en train de vérifier les disques avec un outil spécifique qui n'est plus utilisé depuis des années par les garages. La raison est que les garagistes sont des vendeurs de pièces et qu'ils n'ont pas confiance en eux.Heureusement j'ai un garagiste avec qui je m'entends bien et il a accepté de réutiliser cette méthode et se filmer en le faisant. Résultat voilage dans les normes, mais plaquettes neuves mal rodée par le livreur ayant conduit le véhicule de Longueuil (60) à Tours (37), en espérant que les plaquettes se refassent aux disques malgré leur vitrification sur le démarrage.Pour un achat à 14000€ je trouve le SAV très zélé et surtout c'est inadmissible que l'on vous vende un réseau partenaire de garage au niveau national pour faire les réparations mais en fait juste en Ile-de-France, dans ma région 0 garage partenaire et ils ne rougissent même pas en le disant.Ayez un garagiste prêt à répondre à toutes leurs demandes tirées par les cheveux si vous leur acheter un véhicule qui malheureusement a des problèmes malgré leurs contrôles.","2023-10-31T19:45:07.0000000Z","None","Vehicle Quality"
"J'ai choisit Autohero pour l'achat de ma première voiture sur la recommandation de personnes étant elles-mêmes passées par ce site. Tout s'est fait rapidement courant septembre. J'ai apprécié la clarté des informations, la facilité de réservation du véhicule jusqu'à l'organisation du rdv pour la livraison avec l'équipe. Le jour J, j'ai pu la vérifier, la tester, tout s'est passé agréablement. Cela fait un mois et je suis toujours autant satisfaite de ma voiture.","2023-10-31T10:27:50.0000000Z","Positive","Satisfaction with Purchase"
"Je ne peux que confirmer que cette société de vente de véhicules en ligne est au top du marché actuellement ! Les détails de votre future acquisition sont en ligne de façon visible claire et nette. Les imperfections constatées sont bien mentionnées et bien visibles par grossissement en ligne,il n'y à aucune surprise.L'achat est fluide, j'ai réglé au comptant par virement et tout s'est absolument bien déroulé. La livraison par Adèl s'est réalisée dans d'excellentes conditions, c'est un livreur très professionnel et très sérieux qui nous à tenus au courant minute par minute pour l'heure de livraison.En conclusion, bien que mon entourage m'ait dissuadé d'un achat en ligne, je déments toute rumeur négative concernant la vente en ligne, chez autohero ce sont de vrais professionnels qui méritent bien ces éloges. En plus , comparez les prix avec d'autres sociétés de vente en ligne et votre décision sera vite prise ! A Bon entendeur salut et bon achat !","2023-10-30T15:28:08.0000000Z","Positive","Delivery Experience"
"Nous avons fait un achat reprise à domicile. Le processus est vraiment bien réglé: en deux heures la nouvelle voiture était livrée et l'ancienne reprise. Nous avons fait un peu plus de 2000km avec la nouvelle voiture et jusqu'ici tout va bien. J'ai particulièrement apprécié le rappel après une semaine pour connaitre notre niveau de satisfaction.","2023-10-30T11:40:44.0000000Z","Positive","Delivery Experience"
"Très belle expérience avec Auto Hero Je me devais de trouver une voiture très rapidement et autohero m’a accompagné du début jusqu’à l’acquisition de ma Ford Ecosport,en pratiquement une semaine. Tout s’est passé rapidement  Un service client très réactif, une voiture que j’adore ! Merci à Denis qui a vraiment été de toute confiance et au monsieur Luc ‘´´XX,  qui m’a livré la voiture. A toute l’équipe ! J’ai d’ailleurs recommandé à une amie qui 2 semaines après a fait une réservation chez vous! Merci pour tout le suivi !","2023-10-27T21:58:14.0000000Z","Positive","Satisfaction with Purchase"
"Très bonne expérience d'achat de voiture d'occasion avec Autohero. Merci à Steevi pour le suivi de mon dossier et à Jean-François le livreur qui peu importe le temps (il pleuvait des cordes) fais son travail avec un grand professionnalisme. La voiture était exactement comme dans la description faite sur le site et énuméré par steevi. La prise en main est totalement expliquée par Jean-Francois qui en plus revérifie le véhicule avant livraison. Bref un achat plus que satisfaisant. Je ne regrette pas mon choix de faire confiance à Autohero. Merci à vous et bonne continuation","2023-10-24T16:16:17.0000000Z","Positive","Satisfaction with Purchase"
"Bon suivi téléphonique avec les conseillers avant la transaction , véhicule quasi conforme à la description sur le site, nettoyage intérieur / extérieur vraiment très bien réalisé. Possibilité de livraison devant le domicile. Pour ma part, toutes factures depuis mise en service, c'est un plus !!!","2023-10-23T08:27:14.0000000Z","Positive","N/A"
"Très bon expérience avec Autohéro. J'étais dubitative d'acheter de cette façon car évidemment acheter sans voir est assez compliqué. Il est très simple d'avoir un interlocuteur tout le long du processus et de garder le même. Rassurants et à l'écoute, ils sauront vous guider ! N'hésitez pas. Mention spéciale à Denis qui à été au top pour ma part !","2023-10-20T14:43:12.0000000Z","Positive","Online Buying Experience"
"1 ère expérience avec Autohero et que du positif, de la reprise de mon véhicule et de l'achat du nouveau véhicule chez Autohero. J'ai réglé en amont la différence. Le jour de la livraison mon nouveau véhicule était en phase avec mes attentes et reprise de l'ancien. Merci pour votre professionnalisme.","2023-10-19T22:07:49.0000000Z","Positive","Satisfaction with Purchase"
"Pour moi, c'est la deuxième fois que j'achète un véhicule chez Autohero. Je n'ai pas à m'en plaindre, le personnel est très accueillant par téléphone, efficace pour traiter les dossiers, et les véhicules que j'ai achetés ont été préparés avec soins, pas de souci à signaler. Je recommanderai sans hésitation ce site.","2023-10-18T14:16:58.0000000Z","Positive","Satisfaction with Purchase"
"On ma livré mon véhicule en 1 semaine c'est tres bien ...sauf que le coffre ne ce ferme pas ni avec la clé ni avec la fermeture centralisé d'autant plus qu'au niveau du tableaux de bord sa indique bien une anomalie au niveau du coffre est pourtant le livreur na ou rien vu ou ne me la pas signalé","2023-10-14T15:24:09.0000000Z","Negative","Vehicle Condition"
"Je viens de remarquer, malheureusement juste après la période d'essai de 21 jours / 500km, que le recouvrement intérieur du pillier gauche du pare-brise est endommagé, comme c'est le cas après un accident frontal, ou un changement de pare-prise opéré par un non-professionnel. Rien de cela n'est noté dans l'historique du véhicule.Les balais des essuie-glaces sont endommagés et j'ai dû les changer à la première pluie.Il y a aussi un bruit de rotule avant droite qui commence à se faire entendre.Sinon, je suis satisfait du véhicule. Il y a souvent des couacs quand on reprend un véhicule d'occasion, et ça aurait pu être pire.","2023-10-10T20:03:05.0000000Z","Negative","Vehicle Condition"
"Le processus commercial via internet est très bien conçu, aussi bien pour l'achat que pour la reprise: simple et efficace. Les échanges avec toutes les personnes de Autohero de la première prise de contact jusqu'à la livraison avec le super camion ! ont été très professionnels et à l'écoute. Je ne vais pas manquer de recommander votre entreprise auprès de mes contacts.","2023-10-06T16:23:21.0000000Z","Positive","Online Buying Experience"
"Le site internet est bien fait, les infos et photos des voitures sont pertinentes et complètes. Les différents contacts avec les équipes se sont toujours bien passés La livraison et la reprise de notre véhicule idem et la voiture est tels que nous l’avions vu sur les photos. ( le camion transparent est franchement sympa c’est un beau moment quand la voiture arrive) Bref, une entreprise au top qui mérite à être connue. J’en parle partout en bien. Je viens de recevoir ma nouvelle carte grise et j’ai rien eu à faire également. Foncez ;)","2023-10-05T19:12:38.0000000Z","Positive","Online Buying Experience"
