"Content","Date","Consumer Sentiment Classifier","Automatic Classifier"
"Ce qui est plutôt satisfaisant avec Autohero, c’est que derrière la démarche et la transaction INTERNET, il y a immédiatement des ÊTRES HUMAINS !!!! Voilà un aspect rassurant surtout lorsqu’il s’agit de l’achat d’une voiture… Rien à dire sur le processus, depuis le premier coup de fil jusqu’à la livraison. Mention spéciale à Monsieur le livreur, Hassan qui se reconnaîtra j’espère, calme, professionnel et fort sympathique.Autre point très important : le produit livré s’est avéré (pour l’instant du moins) très fidèle à sa description numérique.","2024-01-11T23:12:54.0000000Z","Positive","N/A"
"Nous regardions pour une voiture un peu au hasard sur internet et notre choix s'est porté sur un véhicule de chez auto héroMis à part de nom, nous ne connaissions pas Bilan, après des hésitations, nous nous sommes décidés et nous n avons aucun regret !!!!Les personnes de chez auto héro ont été à l'écoute, disponibles et très professionnellesDu début à la fin , tout s'est très bien passé. Plusieurs appels au fur et à mesure de la procédure d'achat et un suivi sur internet impeccable Cela a été plus rapide que prévu pour un rendez-vous pour récupérer notre véhicule qui était conforme à l'annonce La voiture est top , nous n avons aucun regret Quelques jours après, un nouvel appel pour vérifier que nous étions satisfait et que tout s était bien passé Je n hesiterai pas à regarder directement chez eux à l'avenir, beaucoup plus sérieux et pro que certains concessionnaires","2024-01-16T22:05:21.0000000Z","Positive","Professionalism"
"J'ai pris mon temps et j'ai fini par trouver une petite pépite donc je suis extrêmement satisfaite.L'agent qui a pris tout en charge pour m'aider à trouver ma voiture,qui se reconnaîtra et s'appelle Arthur, a vraiment mis tout en œuvre pour me faciliter toute démarche administrative m'a énormément renseigné sur la voiture, m'a conseillé, m'a guidé tout au long de l'achat qui s'est extrêmement bien déroulé jusqu'à la livraison de la voiture.Je suis extrêmement ravie heureuse car c'était la première fois que j'ai acheté une voiture et tout s'est déroulé à merveille merci à toute l'équipe.Je vous souhaite à tous mes meilleurs vœux pour l'année 2024.","2024-01-10T14:01:41.0000000Z","Positive","Satisfaction with Purchase"
"Hausse de prix d'une voiture en remisseAprès avoir vue une voiture correcte, avec un prix qui avait une remisse de 2600€ j'ai appelé vendredi mon conseiller Autohero Jason et lui dit que je me décidé le lendemain samedi après avoir parlé avec ma banque.Le samedi au moment de faire la réservation sur internet SURPRISE la voiture avait monté de 600€ (J'ai les captures d'écran à l'appui) donc j'écris encore le conseiller mr J. pour comprendre cette hausse de prix et me dit qu'il ne peux rien et faire que le siège lui a dit que c'était un erreur!Est ce normal le prix qui montent et descends quand ça leur chante ce n'est pas sérieux ni sécurisant pour moi/pour nous les utilisateurs!Vanessa S.Ps: mr J. du service commercial a mes cordonnes!","2024-01-27T07:02:00.0000000Z","Negative","Pricing"
"Très bonne expérience après vente avec autohero, j’ai acheté la voiture il y a 4 mois, un Qashquai, la voiture était très propre à l’intérieur mais ils ont été réactif et ont payé à hauteur de 50 euros pour le lavage, ensuite un petit souci auquel ils ont aussi remboursé à hauteur de 134 euros. Ce n’est pas parfait, mais c’est rassurant d’être bien pris en charge après l’achat donc je recommande, ils sont reglo.","2024-01-22T14:02:38.0000000Z","Positive","After-Sales Service"
"Suite à ma demande de contact j'ai été rappelée très rapidement et les explications données par le conseiller commercial étaient très claires. La livraison a été plus rapide que prévu et s'est parfaitement bien déroulée avec une procédure très rigoureuse. La voiture correspond tout à fait à l'annonce. Je recommande!","2024-01-05T12:19:14.0000000Z","Positive","N/A"
"Les services Autohero 5 étoilesDes personnes gentilles polies efficaces, un grand merci à elles.Dossier, réservation, livraison 5 étoilesRien à dire d'autre que exceptionnel.Seul bémolLa voiture sent fort du pot d'échappement, ça fait un problème à régler. Je m'en suis rendu compte trop tard pour faire la réclamation. J'adore ma nouvelle voiture (fiat panda 2014 diesel) super état mais déception sur ce problème.","2023-12-15T20:57:40.0000000Z","Positive","Vehicle Condition"
"Je recommande fortement !! Ils sont très à l'écoute ,très réactif. Les démarches ont été extrêmement facile et j'ai été guidé tout le long. Une mention spéciale pour la personne adorable qui s'est chargé des papiers pour reprendre mon véhicule et pour le nouveau véhicule. Un accueil vraiment au top . Vous pouvez y allez vraiment les yeux fermés et en toute confiance.","2023-12-28T18:13:57.0000000Z","Positive","Customer Service"
"J’avais des appréhensions comme c’est ma première voiture sur internet, arnaque ect… J’ai eu plusieurs échange téléphonique avec un conseillé vendeur qui m’a guidé et donner des renseignements. En suite l’étude de mon dossier m’a rassuré et on est tenu au courant très régulièrement pareil pour la livraison. Ça a été assez rapide ( en un peu plus d’un mois j’ai eu la voiture). Livreur vraiment très gentil qui également explique tous les papiers.Puis on nous remet les clefs et c’est partie. Quelle belle surprise, la voiture était nickelle et j’en suis très contente, y avait même la roue de secours. On a 20 jours d’essais. Ça fait deux semaines que je l’ai. Je compte la garder je suis complémente satisfaite. Merci pour le suivi client !","2024-01-17T17:50:02.0000000Z","Positive","Purchase Process"
"Je note plus la livraison et la correspondance du véhicule à l'annonce. Après 30 jours je n'ai pas eu de soucis particulier sur le véhicule, je l'ai donc gardé, et j'en suis très satisfait. La possibilité de le retourner sans frais avec un remboursement à 100% m'a fait sauter le pas et acheter sur internet et je n'ai pas été déçu.","2023-12-28T23:13:15.0000000Z","Positive","Satisfaction with Purchase"
"Facilité d'accès au cite et aux pages dédiées aux véhicule.Descriptifs et détails visuels parfaits.Disponibilité et réactivité du service commercial et très bon suivi de la commande.L'option livraison à domicile quel confort, sans parler de la dispo pour la prise en main de la voiture.Bien que septique pour un achat à distance sans voir le véhicule, je suis entièrement satisfaite de la prestation de Autohéro sans même parler du prix qui était très attractif.","2023-12-22T10:07:28.0000000Z","Positive","Online Buying Experience"
"Sceptique au début c’est vrai, j’ai fais un certain nombre de site pour vérifier la fiabilité de l’enseigne.Je vous recommande les yeux fermés autohero !Prix compétitif, la transparence, l’écoute, la rapidité du traitement de question et de l’achat.Je suis plus que ravie d’avoir acheté mon véhicule sur autohero.","2023-12-14T21:50:11.0000000Z","Positive","Satisfaction with Purchase"
"Dès le premier contact,  le service commercial a su apporter toutes les réponses à nos questions. Le process de commande est cadré et rassurant. La description du véhicule est très claire et transparente avec la fourniture des factures et CT.Voiture livrée très rapidement par une personne compétente et à l'écoute. En conclusion,  une très bonne expérience que je recommande pour un achat en ligne.","2023-12-19T13:57:47.0000000Z","Positive","N/A"
"La voiture correspond aux attentes. Par contre, plus de 4 mois d'attente (plus sans dispositions prises) pour la carte grise avec l'option pour laquelle autohero se charge de l'édition de la carte. Aucunes nouvelles, aucunes relances, ils se renvoient la balle, vous prenne pour un lapin de 3 semaines mais ont bien encaissé l'argent. Donc carte grise faite par mes propres moyens... Avec 5 mois de retard. Un service administratif d'incompétents !","2023-12-19T10:54:40.0000000Z","Negative","After-Sales Service"
"J'ai fait l'acquisition d'une Audi A5 Coupé chez Autohero. Tout s'est très bien passé dès la prise de contact avec le service commercial, qui m'a bien accompagné tout au long du processus d'achat. Le rendez-vous de livraison fut pris très rapidement, et je fus heureux de trouver un véhicule conforme à l'annonce, bien révisé et bien nettoyé. La garantie 1 an est également très sécurisante.Je recommande Autohero pour son sérieux et la qualité de ses véhicules ! Merci !","2023-12-08T16:29:32.0000000Z","Positive","Satisfaction with Purchase"
"Très satisfaite de ma commande AutoHero effectuée ce mois-ci. J’ai acheté une Renault Capture et du début à la fin, tout s’est bien passé. Je remercie le commercial Jason pour son accompagnement. Un grand merci aussi au chauffeur Luc Olivier qui a un vrai sens du détail, il a pris le temps tout m’expliquer lors de la livraison. Un grand merci à toute l’équipe Je recommande vivement","2023-12-13T16:43:31.0000000Z","Positive","Satisfaction with Purchase"
"Suite à un problème survenu sur ma voiture, j'ai du contacté le service après vente Autohero. J'ai été très agréablement surpris par le professionnalisme et la gentillesse de l'équipe qui a pris directement en charge ma voiture du début jusqu'à la résolution du problème. Toujours à l'écoute, l'équipe à répondu à toutes mes questions et m'a accompagné jusqu'à la réparation du véhicule. Et pour cela, je tiens à les remercier.Le SAV Autohero est une référence. Tout simplement parfait.","2023-12-15T12:46:16.0000000Z","Positive","Customer Service"
"Achat de la voiture en Août 2023, après deux mois d'utilisation pannes sur pannes, nous en sommes à prés de 4 000 € de réparation et la voiture est toujours au garage !!!! Service réclamation nul tous ce qu'ils reclament c'est la photo du km et a priori trop dur à comprendre que vue qu'elle est au garage on ne peut pas la donner pour le moment.","2023-12-18T17:37:19.0000000Z","Negative","Vehicle Quality"
"Tout à pas été parfait oubli du double de clé et de la carte grise ....petite panne de la prise équipement ! Mais tout à été réglé comme prévu et dans les délais prévu ! Gael à géré les retours de ma panne de manière très reactif et à mis à ma portée les outils nécessaire pour la vidéo qui était trop lourde à l'envoie ....pas évident quand on est un profane en la matière Donc bonne expérience en définitif !","2024-01-04T21:33:38.0000000Z","Positive","After-Sales Service"
"Ça faisait 6 mois que je cherchais un modèle précis (et pas à l’autre bout de la France) et seul AutoHero proposait ce modèle en livraison.Au départ j’étais un peu méfiant (tarif honnête, bel aspect sur les photos, garantie et période d’essai).En fait la voiture m’est passée sous le nez une première fois, puis a finalement été remise en vente 1 mois plus tard. J’ai eu la chance de tomber sur le même commercial les 2 fois -Stéphane, merci à lui- qui avait gardé mon dossier, a retrouvé nos échanges. Il a su me convaincre sans me pousser à la consommation, par une discussion détaillée et technique convaincante.Ensuite, suivi de commande classique mais sérieux.Livraison avec un sms +photo de la voiture sur le camion pour m’avertir de l’heure d’arrivée.Le livreur (Alexandre, de Pessac) a pris le temps de faire le tour de la voiture avec moi + essai routier.Il ne me reste plus qu’à croiser les doigts pour ne pas avoir de soucis technique, mais on a pris la garantie premium.Merci l’équipe AutoHero","2023-12-22T22:06:47.0000000Z","Positive","Purchase Process"
"Une première pour moi, l achat d un véhicule en ligne,mais surement pas la dernière avec AUTOHERO.Le site est trés bien fait et trés facile de trouver son bonheur.Le premier contact avec le commercial parfait,il repond a toutes vos questions.Le service client également si vous avec encore un doute sur le deroulement de la vente et la prise de rendez vous pour la livraison trés rapide.Tout est trés trés bien suivi,les papiers ne seront pas un soucis pour vous!!AUTOHERO se charge de tout!!et le meilleur une livraison dans un camion vitrine avec un sympathique chauffeur(mr Ibrahim)qui vous explique tout avec le sourire.Un grand MERCI a toute l équipe AUTOHERO ,ne changez rien vous etes au TOP et trés proffessionnel.J adore mon nouveau véhicule.","2023-12-15T18:46:52.0000000Z","Positive","Online Buying Experience"
"J’ai acheté une Mégane 3 coupé, tout s’est bien passé de la vente au sav, lors de la vente, Stéphane m’a très bien conseillé et a été réactif pour chaque demande, lors de la livraison, le livreur Laurent a été à l’heure et me tenait au courant de l’avancée de son trajet, les papiers ont été faits rapidement et il a été très gentil. Quelques jours plus tard j’ai eu un petit problème de vanne egr, Jean du sav a été toujours très réactif également et m’a accompagné dès les démarches de réparation, j’ai été intégralement remboursé facilement et rapidement. Pour résumer, tout le service est aimable, honnête et très professionnel, je suis entièrement satisfait de l’ensemble de mon acte d’achat.","2023-12-25T10:03:35.0000000Z","Positive","After-Sales Service"
"Très satisfaite de mon achat chez Autohero tout c est très bien passé, aussi bien pour la réservation sur le net, que pour la réception de notre véhicule, personnels très disponibles toujours la pour nous répondre, pour la livraison livreur très agréable et disponible pour répondre à nos questions.","2023-12-29T15:44:31.0000000Z","Positive","Satisfaction with Purchase"
"Achat d'une Citroën C5 2017.Pour commencé.Le positif:-Commande et suivi simple et plutôt clair.-J'ai choisi le règlement en chèque de banque a la livraison du vehicule (ce que je trouve rassurant).-Une fois la commande validé. Début de quelques jour d'attente pour avoir une date de livraison qui sera respecté par autohero sans problème a l'heure et avec un livreur très sympathique.-Un SAV réactif et disponible (mail/telephone)Le négatif: -Aucune négociation possible.-Je reçois un véhicule a la finition baclé qui n'a clairement pas été nettoyer après la commande (aspirer pour les photos sur le site mais pas propre!)-j'ai a la réception devant le livreur un voyant ""niveau huile"" - un impact certe minime sur le hayon de coffre qui n'étais pas la sur les photos de l'annonce ni dans les défaut du vehicule et donc post commande.Échange par mail avec le sav: -On me propose un remboursement de 50e pour l'impact sur la carrosserie-100e pour le nettoyage non fait - le remboursement d'un bidon d'huile pour la mise a niveau sur présentation d'une facture.Après plusieurs échange de mail ou j'exige le remboursement des frais de préparation on m'explique que les frais ne couvre pas que le nettoyage mais aussi la vérification des niveaux d'huile notamment (ça tombe bien ils étais mauvais).Je finirais tout de même par obtenir le remboursement des frais de préparation (200euros) après menace de leur redonner la voiture étant toujours dans les délais de rétractation de 21j et 500kms.cependant je ne verrai pas la couleur de mon bidon d'huile car l'ayant en stock j'ai fait le niveau de mon véhicule sans en acheter un nouveau je n'ai donc pas de facture et pour l'impact on collera un sticker cache misère.EN CONCLUSION: Mon expérience pourtant bien partit a été en partie gaché par le fait d'avoir reçu un véhicule sale et abimé par autohero.Le sav n'aura fait que le minimum exigible pour la livraison d'un véhicule dans un tel état a savoir me rembourser les frais de nettoyage mais ils ont au moin le mérite d'être très disponible par mail ou telephone.Une petite moyenne car j'aurais apprécier un geste un peu plus généreux de leurs part.","2023-12-14T20:28:44.0000000Z","Negative","Purchase Process"
"Je suis assez satifaite de mon premier achat en ligne. J'ai récupérer mon véhicule aujourd'hui même alors j'espère ne pas changer d'avis 😅 je me permet d'enlever une étoile parce que j'ai régler 368€ pour la livraison et la préparation de ma voiture. La seule livraison proposer se trouve à 117km de chez moi, j'ai tout de même payer cette livraison ainsi qu'un billet de train à 35€ et un taxi à 16€ (pour 4,3km) puisque que même me récupérer à la gare ce n'étais pas possible, passont les joies de l'achat à distance (qui me reviens a 170€ et pas à ma porte), je récupère mon véhicule acheter à 9928km, qui en a maintenant 10497, j'ai vu après commande, dans les petites lignes, que mon véhicule peut être ramener au point de livraison par la route et donc qu'autohero s'autorise 800km d'écart entre l'achat et la livraison, encore une fois passons, par contre le voyant de pression des pneus qui s'allume à 10558km et l'absence de lave glace, au prix des frais de préparation (249€) je trouve ça sincèrement abuser...Sinon le véhicule est très fidèle à sa description et pas de mauvaise surprise, il a été livrer dans un garage ""vendezvotrevotrevoiture.com"" très bon accueil de Cindy, très sympathique, elle a prit son temps pour m'expliquer au mieux les petites choses à savoir sur le véhicule et j'ai put partir pour mes 117km du retour sereine !","2024-01-03T18:19:40.0000000Z","Negative","Online Buying Experience"
"Véhicule acheté avec multiples problème 12000 euro mois de mai 2023 bosse non mentionné sur l annonce/ tâche sellerie qui apparaissent après 2 semaine quand leur produits ne fais plus effet j ai du faire changer bielle rotule de direction etc car complètement HS a 110 km le véhicule tremblais ds tous les sens  puis se suive problème d' accoup a répétition bilan du garagiste kit volant moteur et embrayage HS  réponse d autohero prise en charge du volant et 50 pourcent de la main d oeuvre sur un véhicule garantie pourtant 1 an sur la transmission le reste c est pour moi a payé même le garagiste m'a dis il se moque de vous complètement le kit se change essemble  bref je vais allé déposer plainte et on verra la suite....  donc autohero société a fuir  rien a voir où j'ai eu a faire avec d autre beaucoup plus correct méfier vous méfier vous pour moi a fuir!!!!!!! Et en plus en réponse des vrai menteurs la main d oeuvre volant moteur a été pris a 50pourcent/et le véhicule fais 6000km si on réfléchit même avec la pire des conduites on ne tue pas un embrayage en 6000 km chose impossible des menteurs","2023-12-20T14:34:41.0000000Z","Negative","Vehicle Condition"
"1er achat d'une voiture via internet chez autohero! Autant  dire qu'on est pas rassuré n'ayant pas vu la voiture en réel. Encore plus lors de la livraison du véhicule où je ne reçois qu'une des deux clés annoncés sur le site. mais  apparemment fait exprès pour la période d'essai des 21j de rétractation ou les 500km. Néanmoins si reproches: c'est de n'avoir pas donné l'historique papier du suivis du  véhicule  lors de la livraison. MAIS véhicule récent j'ai fait confiance et pas déçus  lors de la réception des documents .c'était une Expérience positive et satisfaisante, le  professionalisme est au rdv, chaque questions- répondus.  doutes-rassurés, ce qui avait été annoncé a été fait. livraison en temps et heures, véhicules propre a la livraison. Exactement comme sur la description du site . Voir même encore plus beau en réel. Le suivis de la commande et le financement  carré. Merci a l'équipe autohero de m'avoir permis d'acquérir ce véhicule que je voulais.Je recommandes","2023-12-07T01:45:06.0000000Z","Negative","Online Buying Experience"
"Très bonne expérience Autohero sont très présent et très à l’écoute si vous avez la moindre question il vous réponde il sont toujours disponible . Très accueillant merci à la personne qui m’a remis mon véhicule il était très gentil il m’a tout remontrer tout expliquer dans les moindre détails nous avons refait le tour du véhicule . Je ne regrette pas mon achat chez vous à distance","2023-12-03T11:23:48.0000000Z","Positive","Satisfaction with Purchase"
"Très contente de cette entreprise sérieuse et fiable. C'est "" facile "" d'acheter une voiture, le site est bien construit. Il y a de nombreuses informations et les comparaisons de véhicules sont pratiques. Le suivi du dossier, les conseils de l'équipe sont au RDV. On a un ou deux interlocuteurs qui connaissent parfaitement votre projet. Ils sont facilement joignables... Sans oublier ; le véhicule est conforme à ce qui est présenté en ligne. Bref, la formule est bonne!","2023-11-30T12:56:24.0000000Z","Positive","Online Buying Experience"
"Bonjour,J'ai fait l'acquisition d'un véhicule via le site autohero fin août 2023. Je précise que c'est la première fois que je faisais une transaction de ce genre en ligne.Avec le recul je peux à présent donner un avis objectif sur cette enseigne.Auto Hero est une entreprise très sérieuse. Le suivi de la transaction était conforme à mes attentes. La livraison s'est bien déroulée et le véhicule était à l'identique de la description sur le site. J'ai eu un souci moteur quelques temps après et le SAV a été réactif. Le défaut n'était pas couvert par la garantie mais Auto Hero a fait un geste commercial en prenant la quasi totalité des réparations à leur charge.J'ai récupéré mon véhicule comme neuf.Je tenais donc à partager mon expérience pour lever tout doute quant à leur honnêteté.","2023-11-30T12:03:32.0000000Z","Negative","After-Sales Service"
"Très mauvaise expérience avec cet organismeJe le déconseille fortement.J’ai acheté un véhicule et à la livraison de celui ci le véhicule avait un voyant moteur allumé je décide de le rendre la restitution se fait sans encombre.Quelques mois plus tard je décide de refaire confiance à autohero j’achète un jeep compas en août 2024 avant la livraison une collaboratrice d’autohero me contacte pour modifier la date de livraison car l’écran tactile de la voiture ne fonctionne pas et ils doivent le changer, j’accepte le nouveau délais de livraison.À la livraison le véhicule  a un voyant moteur allumé l’écran tactile ne fonctionne pas (alors qu’il devait être changé) je me retrouve dans une situation délicate car je ne possède plus de véhicule néanmoins le service SAV me rassure « tout sera pris en charge mr ne vous inquiétez pas amenez la voiture chez jeep et envoyez nous le devis »Chose que j’ai faites.Nous sommes plus de 5 mois plus tard est rien est fait autohero me demande de contacter le constructeur celui ci ne répond à aucune relance autohero ne répond pas d’ailleurs en dehors de mail très polie me demandant d’attendre.Mon véhicule est mon outil de travail je ne peux me passer de l’écran je suis à ce jour sans solution ac un écran gps Bluetooth inexploitable et un voyant moteur allumé en permanence.C’est pas honnête.","2023-11-29T18:25:26.0000000Z","Negative","Delivery Experience"
"Je suis ravie d'avoir acheter ma voiture chez eux malgré le fait qu'acheter en ligne sans voir le véhicule fait un peu peur. Les conseillers sont à l'écoute et super réactifs, à la livraison de la voiture (dans sa belle galerie) il y a eu un petit couac sur la plaque d'immatriculation malgré ca le remboursement a été très rapide. Je recommande vraiment.","2023-11-28T18:37:38.0000000Z","Positive","Satisfaction with Purchase"
"Très très content de mon achat, première expérience chez Autohero avec de l’hésitation au départ… lol 😁 très bonne expérience du début à la fin !tous les Personnels à l’écoute, facile à joindre si besoin, le délai de la livraison du véhicule est très rapide au top ! Nos craintes ont finalement rapidement disparu dès que nous avons vu notre véhicule et nous n’hésiterons pas à renouveler notre confiance pour notre  prochain achat 😘Merci à toute l’équipe 😘😃😍","2023-11-28T10:55:07.0000000Z","Positive","Satisfaction with Purchase"
"Ras ! Première expérience chez Autohero avec de l’hésitation au départ… finalement très bonne expérience du début à la fin ! Personnel à l’écoute, facile à joindre si besoin… délai de livraison du véhicule même plus rapide que prévu ! Le véhicule, pour nous une Fiat 500 correspondante à 100% avec l’annonce ! Réellement très satisfait ! Nos craintes ont finalement rapidement disparu et nous n’hésiterons pas à renouveler notre confiance pour un prochain achat ! Merci à toute l’équipe 👍","2023-11-27T23:20:21.0000000Z","Positive","Satisfaction with Purchase"
"Vehicule réceptionné comme annoncé sur le détails et dans les temps.Problème de filtre à huile défectueux au bout de 4 mois et 9950km, après différents échanges avec le sav et une note négative sur Truspilot le sav a pris en charge la vidange. Liquide de refroidissement détecté sale alors qu'ils sont censé avoir vérifié le véhicule avant la vente. La garantie basique est un tout de même un peu courte pour des pros. A voir dans le temps.","2023-12-13T14:51:20.0000000Z","Negative","Vehicle Condition"
