Date,Place,Reviews
6/14/22,Mercedes-Benz Stadium - Atlanta,"Everything about this venue, the food, the seats, merchandise was planned very well and organized! I am  disabled and in a wheelchair,but it was easy to move around and the security personnel were very accommodating and professional! The concession line was great and the food and drinks were very reasonable in price and tasted very good and was hot and having unlimited refills on soft drinks was amazing! The show was great and the artists phenomenal! Coldplay really lived up to their reputation as Global Citizens by having everything used in the show being sustainable and recycling lots of the technology used in the show, utilizing the open roof to keep the venue cool and the bicycles to charge the tech and equipment used in the show. Well Done and thanks to the Mercedes-Benz stadium staff too!"
6/14/22,Mercedes-Benz Stadium - Atlanta,This concert was everything I wanted it to be plus so much more.  The mix of old and new songs was perfect. The crowd was very engaged.  They have not played in Atlanta in 21 years and they sound just as amazing today. This is not a show to miss!!!
6/14/22,Mercedes-Benz Stadium - Atlanta,"Such a fantastic event. Cold play concert is the best combination of talent , technology and massive collective participation !"
6/14/22,Mercedes-Benz Stadium - Atlanta,Love the lights love that Chris Martin wanted The fans on Americans to get involved with his songs and saying it was just a beautiful amazing experience I am so happy that I went with the man that I love we both love Coldplay and Chris Martin he is an amazing artist
6/14/22,Mercedes-Benz Stadium - Atlanta,I am so glad that I bought these tickets. It was an amazing show and I would tell anyone that is a Coldplay fan to BUY the tickets! You won’t regret it!
6/14/22,Mercedes-Benz Stadium - Atlanta,"Coldplay is awesome! They’re awesome I. The studio and even better live. This is my second time seeing them and their audio/video for the show is the best. The Mercedes Benz stadium was trash. There was so much echo during the opener that they decided to open the roof. Also, Chris Martin stuttered during a song so I know the echo got to him. This place is terrible for concerts. I wouldn’t recommend seeing a show here."
6/14/22,Mercedes-Benz Stadium - Atlanta,"The concert experience was very engaging.  The wristbands they give you  are interactive throughout the show and is unlike any other experience you will ever have at a concert.  If you have a chance to go, do not hesitate!!"
6/14/22,Mercedes-Benz Stadium - Atlanta,Coldplay has been my favorite band ever since I was a child and I had always dreamt of attending one of their concerts. Finally got to see them in ATL this time and every aspect of the concert was magical! I would definitely want to attend another one of their concerts.
6/14/22,Mercedes-Benz Stadium - Atlanta,"The Coldplay concert was amazing from start to finish. HER did a wonderful job transitioning from her soulful songs to songs with a little more “rock” flavor. I’m sure she gained a few more fans. Coldplay intertwined their musical genius with fantastic showmanship and creative use of lights. I sang, danced, and ohed and awed the entire night. Having Kelly Rowland join for a song was also a nice touch."
6/14/22,Mercedes-Benz Stadium - Atlanta,I didn’t think I would ever get the chance to see Coldplay live. Tickets are usually expensive and hard to get not to mention traveling costs as well. My fiancé and I were able to get our tickets for $80 each in the “nosebleed” section which in my opinion ended up being one of the best seats in the house. You could see the entire layout of the stadium and in turn got the full experience of Coldplays fantastic light display. They really put on a performance that could be enjoyed regardless of where you were seated. I got to hear songs played live I’ve always wanted to hear. It was fantastic
6/14/22,Mercedes-Benz Stadium - Atlanta,"I’ve been to hundreds of shows and festivals from the stones, to jack white, to LCD sound system, and Coldplay easily is top 3 for me all time! Incredible. Chris Martin is one of a kind!"
6/14/22,Mercedes-Benz Stadium - Atlanta,We were incredibly impressed with Coldplay and their energy for the entire show.  My wife’s a huge Coldplay fan and this show was a dream for her.  I am a casual listener and I was thoroughly impressed with how entertaining they were.  Mercedes Stadium is a great place to see a show as well.
6/14/22,Mercedes-Benz Stadium - Atlanta,"We only paid $20 for infinity tickets so we really can’t complain too much. I thought I would be happy to be anywhere in the stadium but our seats were so high up, to the side of the stage and behind the speakers. The sound was horrible. You could barely tell what songs they were playing. We did enjoy the light show from up there though. Fortunately it wasn’t our first Coldplay show and the last one we saw was amazing!! Learned my lesson on buying infinity tickets and driving eight hours to get to a show we couldn’t even hear!!"
6/14/22,Mercedes-Benz Stadium - Atlanta,"Best performance ever, hands down! I don’t think you can ever top the experience. Sound, music, lights, and overall genuine presence of a band that is truly having fun and living their dream. It showed. Great venue with fluid traffic flow and amazing organization for that number of people."
6/14/22,Mercedes-Benz Stadium - Atlanta,"Coldplay was amazing, the show was spectacular! H.E.R and Mariah did great too! So much energy, the way they connected with the audience was great! An event that is unforgettable! I hope to see them again one day! The stadium was great too! I loved it!"
6/14/22,Mercedes-Benz Stadium - Atlanta,Coldplay totally outdone themselves! This was the best concert experience I've had as far as artist goes. Venue...needs improvement on getting where you need to go. I wasn't happy about most of the before..but Coldplay...speechless!
6/14/22,Mercedes-Benz Stadium - Atlanta,I have been to a lot of concerts this was the best by far! I will never forget it. All types of ppl and races all came together and had a great night!
6/14/22,Mercedes-Benz Stadium - Atlanta,I would see Coldplay yearly if that was their tour schedule. They put on the best show I have ever seen. I love how sincere they seem and they are always so gracious to their fans.
6/14/22,Mercedes-Benz Stadium - Atlanta,"The concert was the most amazing night!! Insane performances, best songs, cool vibes, and amazing special effects!! I love them so much and it was my 1st concert with them and there was not ont one moment where I was not loving it!! So special ♥️ Thank you Coldplay, you were aMaZiNg and you did not disappoint!! 💙🤍💚🧡"
6/14/22,Mercedes-Benz Stadium - Atlanta,"First the venue was awesome… Mercedes Benz in Atlanta was full and open and Just a great space. 
COLDPLAY was on point and killed butt. They had a great vibe with the crowd…singing with us and just kicking it. BEST CONCERT OF 2022!!!"
6/14/22,Mercedes-Benz Stadium - Atlanta,"Wow!!!  Coldplay were absolutely amazing!!  The lights, the fireworks, the sound, the interaction was incredible.  Please tour the south again- ATL, North Florida area!!"
6/14/22,Mercedes-Benz Stadium - Atlanta,it's not a concert. it's a once in a lifetime experience that makes everything going on in the world disappear totally if only for just a few hours. would go 1 million more times if i could. would follow them around the world if i could!
6/14/22,Mercedes-Benz Stadium - Atlanta,"Never a bad show. Worth every penny, and most definitely an experience. Fun, energetic, visually and audibly vibrant. Awesome night"
6/14/22,Mercedes-Benz Stadium - Atlanta,First ever Coldplay concert! It was amazing! The wristbands you wear for the extra lights was super fun as well as offering to dance or bike to help power the stage! The music quality was excellent (and loud) The only downside was trying to get an Uber or Lyft ride back to the hotel. They may wanna offer something in the future to make getting a ride a little more easier for travelers/tourists but that isn’t directly a concert issue I know lol
6/14/22,Mercedes-Benz Stadium - Atlanta,"A Coldplay show isn't a concert; it's a full experience. If you ever get the chance to see them, do it! You'll get all the feels and probably a good workout in the process."
6/14/22,Mercedes-Benz Stadium - Atlanta,"Absolutely amazing show! I have been wanting to see them since I was 12 and finally got the chance to. They exceeded my expectations as artists, musicians and humans in general. They have a huge heart and I love that they use their platform to help those in need and for our planet as well 💙 Would love to see them again soon!"
6/14/22,Mercedes-Benz Stadium - Atlanta,"I waited for two years for Cold Play to come to America, and better to my City of Atlanta. The performance was all that. The sound was perfect, the band was on point, and the interaction with the audience was invigorating. If you love music please see this band."
6/14/22,Mercedes-Benz Stadium - Atlanta,Probably the best concert we’ve ever attended!  Coldplay put on an amazing show - can’t imagine it any better.
6/14/22,Mercedes-Benz Stadium - Atlanta,"Doors did not open on time (5:30) so people were standing in the hot sun for an extra LONG time. Once inside (that process was smooth with easy security walk-through detectors and ticket scanning kiosks) the  venue provided excellent food options with wonderful low price-points ($2 popcorn!) Mariah the Scientist impressed with her effortless vocal range and H.E.R. wowed us her range of instruments and talent. At some point as the sun was about to set the roof was opened and we all enjoyed watching an impressive display of modern engineering-and welcomed fresh air. I’ll be honest-I must be getting old to say this-I feel like it was a bit too loud. Especially the openers (do they have to be as loud?) It felt like a volume for an outdoor arena but other than the hole at the top, we were definitely indoors. I saw a lot of people wincing at first. Anyway…around 9:00, just after sundown, Coldplay was introduced by a sweet family (apparently they had sent an email thanking the band for including the hearing impaired and we’re contacted to do this 🥰) The band entered and our bracelets we were given at entry started lighting up…amazing! The energy from the crowd was electric. The set was the same as the previous show with the exception of Independent Women with Kelly Rowland. The band stopped singing Sky Full of Stars to ask us to put our phones away and enjoy this one song together, saying that coming to Atlanta felt like Christmas to the band. It was a special energy created-everyone was UP! Overall a terrific set list of old and new. The lights, the confetti, the big screens, the band giving it their ALL for 2 hours…a great show. Chris must have some serious cardio training! My personal highlights were Adventure of a Lifetime, Viva la Vida (the audience singing with them) and Sparks. I love this band dearly so I say with love that the singing of Something Just Like This wearing an alien head doing sign language was puzzling but then topped later by a muppet, yes an actual muppet, singing Biutyful with Chris. No one knew what to do with that. 
So overall definitely worth the money and the 40 minutes getting out of the parking deck at 12:30am. I should note that the line for Uber/Lyft was daunting. Hundreds of people just standing by the curb. Now I must re-watch all my videos and try not to be sad it’s over."
6/14/22,Mercedes-Benz Stadium - Atlanta,Best concert I have ever been to! Loved being at the Mercedes Benz stadium it was beautiful! The show was spectacular with Chris Martin being very entertaining and genuinely enjoying himself! I would definitely recommend going to the concert! You will not regret it!
6/14/22,Mercedes-Benz Stadium - Atlanta,One of the best concerts I have seen. We were sitting in the second row of the upper deck but felt like we were part of the concert
6/14/22,Mercedes-Benz Stadium - Atlanta,"Easily one of the best concerts I have ever seen, and I’ve seen a lot of concerts. Coldplay was so much fun to watch and the entire show was an uplifting experience. Chris sounded great, as well as the rest of the band. Coldplay and myself are both huge fans of U2, and I certainly felt their influence on Coldplay’s show. Just incredible."
6/14/22,Mercedes-Benz Stadium - Atlanta,The Coldplay concert in ATL was exceptional!  They put on the best concert I have seen over the years.  The crowd was very much into the show and it made the experience that much better.
6/14/22,Mercedes-Benz Stadium - Atlanta,H.E.R. and Coldplay were great!  Loved loved loved the wristbands Coldplay lit up during their performance.  Super cute when the wristbands were yellow during the “Yellow” song.  The 4 star rating is not a reflection of how I felt about Coldplay.  It’s due to the poor sound quality that I attribute to echoing in the Mercedes Benz Stadium.  Once they opened the roof the sound was much better.  I expected better from a new stadium.
6/14/22,Mercedes-Benz Stadium - Atlanta,Getting in and out was easy. The venue was well air conditioned. The sound was very good. Coldplay put on an incredible show!
6/14/22,Mercedes-Benz Stadium - Atlanta,"The show was amazing!  The opened dome, lighting, pyrotechnics, wristbands, and ENEGRY made for such a fun concert!  Coldplay played a good combination of newer songs and old favorites. Chris and the band also had great interaction with the crowd. 
The venue was comfortable, clean, easy to walk to, had good food and drink options, and the staff were friendly and helpful - I  would definitely consider traveling to another concert there."
6/14/22,Mercedes-Benz Stadium - Atlanta,It was an amazing experience!  One I will treasure always!  I love Coldplay!  The music speaks to my soul!  The special affects made the experience surreal! Thank you Chris and your talented band!  You’re sharing your gifts and making the world a better place!
6/14/22,Mercedes-Benz Stadium - Atlanta,"I bought tickets for my daughter's birthday.  She is one of H.E.R. biggest fans and she was opening for Coldplay. I told my daughter if she ever had a concert that I could drive to I would take her. Well, I surprised her with tickets. She almost jumped out of her skin when H.E.R walked out on stage. She knows everything about the singer. I wish  she could have met H.E.R. in person backstage or something.  Coldplay was AWESOME also. That was my first time hearing their songs and we loved every moment. It was very interactive and one of the highlights we enjoyed was the singing and the wrist bands. We had an awesome time."
6/14/22,Mercedes-Benz Stadium - Atlanta,"The lights and effects, if possible, were as extraordinary as the music. So many great songs and EVERYBODY knows the lyrics. Chris Martin sang his heart out. Band members were all spectacular. Great charities were supported by everyone's ticket prices. The whole concert was a win-win."
6/14/22,Mercedes-Benz Stadium - Atlanta,We loved the show. We knew that we were going to be far away but couldn’t buy seats closer to the stage. Very expensive. But the sound was very bad at the top of the stadium. Sometimes it was hard to even recognize the songs.
6/14/22,Mercedes-Benz Stadium - Atlanta,"This was a great concert and venue. 
The stadium was so easy to navigate and everything was really well managed.
The COLDPLAY concert experience was all that I had hoped for. It’s really almost a stage show. The band is all so into everything, and then having the light up wristbands you get to be an interactive part of the show as well. 
This was my first concert at a big stadium like this. I wore ear plugs while the ceiling was closed, but once they opened the roof I took them out and it wasn’t overwhelming even though I’m a total introvert with sensory issues."
6/14/22,Mercedes-Benz Stadium - Atlanta,Magical evening with Coldplay! I’ve seen Coldplay now five times and this was by far the best show. They are so entertaining and the energy in the room is over the moon. Love everything about it. Will go see them again…
6/14/22,Mercedes-Benz Stadium - Atlanta,"Everything was so organized, stadium clean, stadium personal so attentive and nice, and the COLDPLAY concert was just magical!,awesome, a wonderful and unforgettable experience!!!"
6/14/22,Mercedes-Benz Stadium - Atlanta,"Very entertaining, well put concert! Best concert I've ever been to and that includes a Pink Floyd concert. Will definitely go see them again when they are on tour."
6/14/22,Mercedes-Benz Stadium - Atlanta,Quite literally the best concert I have ever Attended!  The band was energetic and put their all into the entire show.  Great interaction with the fans and the passion they give make the show!  Mercedes Benz Stadium was a great venue to attend!  Very clean and the most polite and accommodating staff!  I would repeat this night anytime!
6/14/22,Mercedes-Benz Stadium - Atlanta,"Coldplay delivered an awesome show with exceptional lighting effects and crowd participation.   Fans were given wristbands upon entering the venue.  These lighted wristbands were synchronized to the music creating the coolest light show.   The opening singer H.E.R. was great and showed off her musical talents on various instruments, playing rap, blues, and soulful ballads.  Coldplay played their hearts out, moving among the stages, giving everyone a show to remember!"
6/14/22,Mercedes-Benz Stadium - Atlanta,"After waiting for years for Coldplay to start a new tour I finally was able to fullfil a life goal :) amazing scenery, lightning. Many great old and new songs. Couldn’t ask for more and I wish I could relive that night!"
6/14/22,Mercedes-Benz Stadium - Atlanta,Mercedes stadium is an awesome arena and the opened ceiling made Coldplay even more awesome! Coldplay has been on our bucket list for years and this was an awesome way to celebrate our 19th wedding anniversary!! They totally rocked the stage!
6/14/22,Mercedes-Benz Stadium - Atlanta,"Me and my family went to this concert and it was hands down the best one we’ve ever been to. The energy was amazing, they interacted with the crowd. This was the kind of concert that even if you didn’t know the words, it would still be fun."
6/14/22,Mercedes-Benz Stadium - Atlanta,Everything went smoothly from ticket buying to parking. The staff at the stadium were friendly and the seats were just as described. AND THE PERFORMANCE WAS PERFECTION. Absolutely the most fun night. I saw Radiohead at the same stadium and it was the worst sound. The Coldplay show was a huge improvement. Best show ever.
6/14/22,Mercedes-Benz Stadium - Atlanta,The integration of the crowd into the show and the ability to take Marta and not have to deal with traffic was awesome. Loved the sound and energy of the band.
6/14/22,Mercedes-Benz Stadium - Atlanta,"We were up very high but it didn't matter.  The show as great, sound was great and the light show was great.  I loved that the roof opened before Coldplay - very positive atmosphere and a very pleasant evening."
6/14/22,Mercedes-Benz Stadium - Atlanta,"We love Coldplay!  HOWEVER.....
The sound system at Mercedes Stadium is horrible.  So loud that it was painful and also distorted.  Show itself was fantastic with the lighting and theatrics on stage.  Hopefully when Coldplay comes back to Atlanta they will choose another venue.  Bigger isn't always better."
6/14/22,Mercedes-Benz Stadium - Atlanta,This tour is truly spectacular. The energy in the stadium was something on another level. My husband and I can not stop talking about it. They really did it to the max.
6/14/22,Mercedes-Benz Stadium - Atlanta,"The concert was wonderful, but I was disappointed that they didn’t provide us with the LED bracelets when we checked in. After getting seated and discovering we were supposed to have the bracelets they had ran out even though they were aware of the number of attendees."
6/14/22,Mercedes-Benz Stadium - Atlanta,"Coldplay gives one of the best shows I've ever seen, if not the BEST. It is entertaining, colorful and energetic! Get ready to end up with your feet hurting and without a voice. BEST BAND EVER!!"
6/14/22,Mercedes-Benz Stadium - Atlanta,"It was a absolutely incredible concert, the show, de details, the sound, the staff , fire works , and of course Coldplay was amazing"
6/14/22,Mercedes-Benz Stadium - Atlanta,"I’ve been to 200+ major concerts and this was absolute best live show I’ve ever seen … including multiple times seeing U2, Prince, Metallica, Lollapaloozas, Ozzfests, DMB, Oasis, Pearl Jam, Beasties, Tool

Band sounded great, Chris Martin has endless energy, the lights/bracelets we amazing. 

Great setlist, so much crowd interaction … just an absolute masterclass on how to bring 50k+ people together into a beautiful night. 

I will 1 million percent go see them again in the future."
6/14/22,Mercedes-Benz Stadium - Atlanta,Coldplay definitely did not disappoint. Finally caught up with them in Atlanta. 2+ hours of full blown energy. Crowd was definitely in to it.
6/14/22,Mercedes-Benz Stadium - Atlanta,"This was more than a concert...a total experience with passionate band performance, lights and fireworks. My only comment for improvement is in regards to getting notified of specifics for our VIP tickets (info on what exactly included, time open, gate to use) and stadium requirements regarding bags. t"
6/14/22,Mercedes-Benz Stadium - Atlanta,One of the best shows I’ve been to. The thoughtfulness of the group truly came through. Would definitely see them again!
6/14/22,Mercedes-Benz Stadium - Atlanta,"My seat wasn’t the greatest, but the experience was top notch!! Coldplay is so good. The wristband lights + music made this the best concert I’ve been to."
6/14/22,Mercedes-Benz Stadium - Atlanta,"Coldplay was on my bucket list and I was so excited to get to finally see them. Best concert I've ever seen! However, the only issue was the acoustics. I heard many complaining about this as well. It was hard to understand the artist when they were talking or really hear the songs clearly."
6/14/22,Mercedes-Benz Stadium - Atlanta,"Concert was Amazing, and Coldplay really blew my mind away. On the other hand, Stadium Personel didn't know where anything was located. I got there on time to make it to the VIP Nation Pre-Party, and everyone told me to go to a different place. long story short, I never made it to the Check-in on time to enjoy at least 5 mins of it."
6/14/22,Mercedes-Benz Stadium - Atlanta,"It was amazing.
I traveled from lima, Peru just for the concert and i loved it. The show si excellent, the stadium is perfect and COLDPLAY y the best band of all.
It was a dream came true"
6/14/22,Mercedes-Benz Stadium - Atlanta,"Perfect seats, incredible band! I’ve been waiting 20 years to see Coldplay and I finally did it! The lights were amazing and made for a magical experience"
6/14/22,Mercedes-Benz Stadium - Atlanta,I’ve have waited to see Coldplay for years and finally got to see them. It was worth the travel and money to be able to see them so closer to the stage. It was a dream come true and I can’t wait to get another opportunity to see them again!
6/14/22,Mercedes-Benz Stadium - Atlanta,"This has been, I say, my most grateful experience watching the talent of a concert. It was never boring and it kept us on our feet throughout the whole concert. I really enjoyed it and some of our proceedings when to something good. Very happy. Thank you"
6/14/22,Mercedes-Benz Stadium - Atlanta,I have seen ColdPlay in concert 3 times now and their shows are unlike any other. They are ABSOLUTELY incredible and no matter where you sit it’s going to be phenomenal.
6/14/22,Mercedes-Benz Stadium - Atlanta,"COLDPLAY was a fun concert with a strong feeling of a huge group coming together as one with the band. With all of the negative in the world COLDPLAY let the crowd know for a couple of hours the world can still be beautiful and peaceful with the fun audience help creating the show working together with the bracelets the band provides for a beautiful light show. As Chris said, ""this is like Christmas"", I had turned to my cousin who accompanied me earlier and said the same thing. The seats were good and the crowd seated around us were nice people. The opened roof made it cooler and the fresh air was nice and made it easier and more comfortable to breathe and feel less stifling. Four people other than myself, that I knew was in the building and it was a nice feeling sharing the experience together. COLDPLAY was like when Freddy Mercury used to bring the crowd together with the band to make the show unforgettable. LOVED IT!!!"
6/14/22,Mercedes-Benz Stadium - Atlanta,My top concert bucket list ☑️. Coldplay's Music of the Spheres was absolutely amazing!  I was literally in tears most of the time. This time with my girls and husband will always be a treasured memory. ❤️
6/14/22,Mercedes-Benz Stadium - Atlanta,Such a great live band. The show was spectacular. We had GA and arrived early to get a spot close to the stage. I’ve seen the band several times and this was the best tour to date. I had 2 friends with me who were seeing them live for the first time and they were thrilled.
6/14/22,Mercedes-Benz Stadium - Atlanta,"Best concert ever!!! We all LOVE COLDPLAY Everything...the stage, the songs, the attitude, the feeling, the lights, the production, the atmosphere....A1"
6/14/22,Mercedes-Benz Stadium - Atlanta,"the experience with the band was unforgettable but the line to buy a hot dog and a soft drink was a failure one hour for them to give me food, one person serving so many people"
