Date,Place,Reviews
6/20/22,Raymond James Stadium - Tampa,"Love their music, first time we attend to their concert, it was the best experience of our life, We took our two sons one of them is a musician and super fan of their music. They have an incredible experience one of a kind, one I am sure they will NEVER NEVER forget. Everything went perfect, the sound, lights, the show, the positive environment. I really have no words to describe how incredible this concert was. We are crazy to see them again!"
6/20/22,Raymond James Stadium - Tampa,"This was hands down the BEST concert I have ever been to. The openers, Gigi and H.E.R., were amazing. And Coldplay was life-changing; their show had such amazing energy!"
6/20/22,Raymond James Stadium - Tampa,Loved every second of this show. The stadium was a great venue easy to get in and out of. Of course Coldplay put on a show of a lifetime. This  show particularly was my fourth one this tour. It gets better and better every time. Thank you for such great memories Coldplay.
6/20/22,Raymond James Stadium - Tampa,"A coldplay concert is a whole different experience, from beginning to end. Regardless if you are a coldplay fan or not, if you attend this concert you will enjoy it to the fullest. The music, the lights, the special effects, the props, the bracelets that light up, the bikes, the kinetic energy floors, the fireworks just make this concert be a complete and amazing experience, your adrenaline will rise to the highest levels. Coldplay played the best hits they have during this show, you will dance and sign your heart out beginning to end. I have seen coldplay three times, this was my favorite one, definitely this is one coldplay concert you don't want to miss."
6/20/22,Raymond James Stadium - Tampa,"Coldplay was amazing. !  I would go see them again anytime.  I was so worried about retrieving the tickets from my phone, but it was easy. I would definitely use ticketmaster again."
6/20/22,Raymond James Stadium - Tampa,"You won’t live a show like the one that Coldplay performs twice in your life, this experience will be in my memories forever. Thank you Coldplay!"
6/19/22,MetLife Stadium - East Rutherford,"Title says it all. Coldplay was amazing, the way they included all attendees in the show using light-up wristbands was creative and beautiful to see in action. But the aftermath was a nightmare and the reason that was the last time I go to a show at MetLife. Friend who was supposed to pick us up couldn't get through bc of road closures by traffic cops, PABT-bound bus line had easily over 1000 people waiting on it, Lyft app was not connecting to drivers bc of the high demand. Ended up walking to the mall across the overpass and, after failing to get a Lyft driver to pick us up there either, met the friend who had originally tried to pick us up, over 1.5 hours after the show ended. Unless you have an easy way out (your own car), the stress is not worth it."
6/19/22,Raymond James Stadium - Tampa,"It was the best concert I've ever been to. The crowd was so excited, everyone was up and dancing. They had bracelets that lit up with the music, and huge balloons for the crowd to hit around the stadium. Chris knows how to get the audience to participate and let us know how much he appreciated us coming out on a super hot Tuesday evening. Multiple stages, 23 songs and we were up dancing to each one. LOVE that they had the stationary bikes, kinetic mat, etc generating energy to run the concert. I LOVE COLDPLAY. Can't wait to see them in concert again. Funtastic time, the vibe of the crowd was overwhelming happiness."
6/19/22,Raymond James Stadium - Tampa,"I couldn't ask for more. Even we the heat, the concert was everything I expected to be and so much more. The band had an incredible energy and stage. They even wrote a special song for Tampa."
6/19/22,Raymond James Stadium - Tampa,"Coldplay was amazing! First time seeing them! Absolutely an electrifying performance and show! If you ever get a chance to see them you should! Worth it and would see them again!

The opener H.E.R. was not good. Her mic was off , her instruments didn’t sound like they were sound checked correctly. Way off especially compared to Coldplay. It just didn’t make sense to have her as the opener. The sounds , songs and everything just didn’t work and a lot of people left their seats."
6/19/22,Raymond James Stadium - Tampa,"Hi! I'm 19, and I thought i ""wasn't a big enough fan of Coldplay"" to see them, and I was wrong. Despite only knowing their most popular songs, this was a DO NOT MISS event, and completely worthy of seeing. I am so glad I did it, and despite probably not being a huge a fan as the millennials going to see Coldplay, I also grew up with them and it was amazing"
6/19/22,Raymond James Stadium - Tampa,It was wild. When it started it got a little out of control because everyone was pushing others to see the band but overall it was the best concert!!
6/19/22,Raymond James Stadium - Tampa,"Went to the Tampa show.  This might have been one of the best shows I have gone to.  I had seen them once before in Kansas City and thought that was amazing, this was over the top EXCELLENT.  This is coming from a huge Peter Gabriel/ Genesis Fan who really enjoys the staging and lighting.  This is a MUST SEE show."
6/19/22,Raymond James Stadium - Tampa,I have never gone to a concert by myself so I was a little curious how seeing ColdPlay would be especially down on the floor. The experience itself was refreshing no matter how hot and humid it was. I had one of the highlights of my life being able to see ColdPlay before me and an experience I would gladly re-live all over again and again.
6/19/22,Raymond James Stadium - Tampa,Coldplay definitely the best band in the world!! They made a lovely night to remember and I wish more concert to come
6/19/22,Raymond James Stadium - Tampa,The best concert experience ever. My second Coldplay concert. They just keep getting better. The music and special effects all come together.
6/19/22,Raymond James Stadium - Tampa,"Concert was perfect. Coldplay did excellent. Even though I was sad, they made me forgot my problems and enjoy the spectacular show."
6/19/22,Raymond James Stadium - Tampa,"It was a hot night at Raymond James Field. Expectation were high before the concert was to start at 7 PM but having to wait over 2 hours past the starting time until Coldplay took the stage, listening to 2 opening acts, made it difficult to rate this concert experience any higher. For the LED wristbands to reach their maximum effect, I realize they needed darkness and thus the after 9 PM start for Coldplay, but if the announced start time would have been 8 PM instead of 7 PM, we could have better used that time instead of listening to two acts that do not compliment Coldplay.  Once Coldplay started the 1st 60 minutes was one of the best concert experiences but the last 60 minutes was dull. A couple of times they had to restart songs and then near the end, a couple talked their way on to the stage so that the gentleman could propose awkwardly. The 2nd 60 minutes did not provide the energy of the 1st 60 minutes and seemed like the band just wanted the night to end."
6/19/22,Soldier Field - Chicago,"Exciting show and entertaining, but it was very obvious those in charge of sound had not gotten out from behind their headphones, because the speaker sound was incredibly bad. I've been to other shows where speakers end up bursting, and this sounded very close to that. Really was a MAJOR distraction to the show."
6/18/22,Mercedes-Benz Stadium - Atlanta,"Sound quality for opening act H.E.R. was terrible, very echoey and distorted. A bit better during her acoustic songs, moved down to 2nd level concourse across from stage… still bad"
6/18/22,Mercedes-Benz Stadium - Atlanta,"The venue, the show, the crowd interaction, the special effects… There is nothing I would change. Coldplay is and always be the best live performance you will ever see!"
6/18/22,Mercedes-Benz Stadium - Atlanta,I took my HS twins to their first show.  They may never see a better one because i haven't.    Only thing close was U2 Achtune Baby.
6/18/22,Raymond James Stadium - Tampa,"From the security, organization, the sound, the lights effect and tha band performance. My friends and I agree that this has been the best concert we have ever seen. I had a lot of complications with my travel, lodging and everything but I would go through everything all over again just to see them!"
6/18/22,Raymond James Stadium - Tampa,"This is my third Coldplay concert, and they were great as usual.  Their live sound combined with the wristbands make it an amazing experience every time.  The only thing I would change is taking the puppet gimmick out and playing Coloratura, but that’s splitting hairs.  If you have the chance to see these guys when they do their second leg, seize the opportunity"
6/18/22,Raymond James Stadium - Tampa,"I have been going to concerts for the past 20 years all over the state of Florida!  Never did we had to wait 2 hours to get picked up by a share ride!  This is due to the extremely bad organization at the stadium!  Coldplay was awesome, one of the best performances, however the exit/dismissal system that the Raymond James stadium has almost ruined our experience!  We will never attend another concert there!!"
6/18/22,Raymond James Stadium - Tampa,"The concert musically & spiritually had so much to offer.. I appreciate you enlightening your audience & the younger generations to pending environmental issues. I’m elated your band chose to remain together, as a group you have so much offer.
My only critique is Chris, easy on the F bomb..please DRock"
6/18/22,Raymond James Stadium - Tampa,"The show and Chris Martin was fantastic with plenty of visual pleasures with everyone having a synced color changing wristband, to fireworks, to confetti and the whole package.

Raymond James (from the 200 club section perspective) is AWFUL. Sounded like noise and hurt my ears...I've been to many...many shows but anything inside a stadium or even worse, inside all together for this type of music turns out awful.

Coldplay and many other artists who put on energetic shows need locations where music doesn't bounce back and reverberate off every wall around. 

3 stars out of 3 for the band (Coldplay) 0 of 2 for the venue (Raymond James)"
6/18/22,Raymond James Stadium - Tampa,All I can say is that Coldplay performance had me with goosebumps and with so much tears of excitement? Very good show definitely grab your seats and enjoy the show!
6/18/22,Raymond James Stadium - Tampa,Coldplay was amazing I would see them a millions times if I could it’s a must show see. Can’t wait until they come again. Hope they don’t take so much time for their come back to Florida!
6/18/22,Raymond James Stadium - Tampa,"I really enjoy the concert it was a perfect , the sound, the energy, the venue. 

The only thing that i was not happy was the organization with the Uber pick up & drop off it was a disaster. And another thing was the mini bag / purse rule at the Stadium. I was with medium purse and i was already there when the tell us about this rule. For next time it would great to hace that kind of info in advance."
6/18/22,Raymond James Stadium - Tampa,so fun!!! definitely one of the best concerts i’ve ever been to. they made us put our phones away so we can all just vibe to Viva La Vida and it was one of the best experiences ever
6/18/22,Raymond James Stadium - Tampa,"Been waiting years for Coldplay to play in Florida again. For me, it was a ""can't miss"" show. After seeing it, they are now a ""can't miss"" band. The concert was absolutely phenomenal.
If I could go again tomorrow, I would. Such a positive energy throughout the whole show. Visual effects were stunning. Quite possibly the best concert I've ever attended!"
6/18/22,Raymond James Stadium - Tampa,"Hi. I live in Honduras, Central America.
 ticketmaster app is not available for latinamerica  so create confusion to get the tickets. I knew that the app is available for Mexico so I don´t know if it work fine for all countries in latinamerica."
6/18/22,Raymond James Stadium - Tampa,"The concert on June 14, 2022, was my first Coldplay concert and it did not disappoint!  The band had incredible energy from the start to the end!  They performed fan favorites (e.g., Sparks, Clocks, Hymn for the Weekend) as well as songs from the Music of the Spheres.  They rocked People of the Pride!  H.E.R. joined Chris for Let Somebody Go - phenomenal duet!  I hope Coldplay continues performing for many years, because I want to see them in concert again!  #ColdplayTampa"
6/18/22,Raymond James Stadium - Tampa,"Aside from the usual save the world lectures and propaganda films , this was a visual and musical tour de force. Definitely top 5 concerts I've ever attended."
6/18/22,Raymond James Stadium - Tampa,"Coldplay put on the most amazing concert I have ever been to, hands down. The energy, the mix of old and new songs, the LIGHTS! Everything was absolutely perfect. I can’t think of one bad thing to say, I will never forget that night! If you have the chance to see them, do it! Again and again."
6/18/22,Raymond James Stadium - Tampa,"Coldplay never disappoints!! This was a special show for us as it was my son’s first Coldplay show! The music was amazing, and Coldplay fans are all so loving and supportive which makes for such a wonderful vibe! So proud of Coldplay for all of their sustainable initiatives on this tour as well. We had a great time riding the bikes and dancing on the kinetic floors to help power the C stage for the next show! We will always cherish our time together rocking out with Coldplay! Just wish they had another show in our area to see them again!"
6/18/22,Raymond James Stadium - Tampa,John Williams! a packed crowd! An original song just for Tampa Bay! Fireworks! The wave! Viva La Vida! Sky Full of Stars! My Universe! Higher Power! All in one package!
6/18/22,Raymond James Stadium - Tampa,This was an amazing concert you couldfeel the beams in the stadium flexing from all the dancing and jumping. The light show was phenomenal! Glad we went!
6/18/22,Raymond James Stadium - Tampa,"It was exciting to be a part of the all positive energy that Coldplay brought to the stage from beginning to the end! I loved being a part of the show, from the wrist bands, the beautiful colorful balls, entire stadium singing with every song! Spectacular light and fireworks show! 
One of the most memorable concerts of my lifetime!
Thank you Coldplay for supporting Ocean Cleanup and reforestation, many thanks for sharing!
A side note, we were treated so kindly by all stadium personal, from the concession people to the greeters coming and going! Great experience for sure!"
6/18/22,Raymond James Stadium - Tampa,The venue was great! Nice seats. The  food/drinks area had AC and bathrooms were super clean. The concert was amazing.. I love how interactive it was.. the energy was great! Loved it.
6/18/22,Raymond James Stadium - Tampa,"If there is a better show anywhere, I’d like to know about it. Wow! What an amazing night. Just can’t imagine there is a better stadium show….anywhere."
6/18/22,Raymond James Stadium - Tampa,This concert was epic and easily the best concert I’ve ever been to. The concert was interactive and so much fun. They played for 2 and some hours. The crowd was awesome. We were all still singing walking out of the stadium!  It felt like we all knew each other. I look forward to being able to see them again.
6/18/22,Raymond James Stadium - Tampa,"There is not enough words to describe how amazing was the concert, all the lights, how the band performed it was just I N C R E D I B L E 10/10"
6/18/22,Raymond James Stadium - Tampa,"While the production of Coldplay was excellent with there sound, light and firework display, H.E.R left us holding our ears. Some people may like to be screamed at, we prefer hearing the melody and words. The male lead singer of the band was pleasant to listen to."
6/18/22,Raymond James Stadium - Tampa,"From the first seconds until the last Chris Martin and band blew the minds of everyone there. A stadium filled with love, electricity, kindness, and music. A night to not be forgotten."
6/18/22,Raymond James Stadium - Tampa,"It has always been a lifelong dream to see Coldplay live. This concert exceeded all of my expectations completely!! They are so genuine and talented and put on such a captivating, lively show. FANTASTIC!"
6/18/22,Raymond James Stadium - Tampa,"Traffic to get to the stadium, was terrible, but once I got there, getting in was fast and easy. They allowed me to bring in my camera too. I was very happy about that. It was a beautiful  show, with amazing special effects. An inspiring message to the world about conservation, peace, and love."
6/18/22,Raymond James Stadium - Tampa,Always the best concerts by Coldplay! Amazing on every level! Chris Martin rocked the Buccs stadium to its core!! Thanks for giving all of your fans such a special show!!!!
6/18/22,Raymond James Stadium - Tampa,The music was fantastic but the added lighting effect brought the concert way over the top.  It was very obvious that Cold Play was there to put on a great show and really care about the people. This is an event that has set a new standard for me.
6/18/22,Raymond James Stadium - Tampa,Loved. Loved. Loved the show. Coldplay puts their heart into every song. The stage set was unreal and the lighted bracelets made every single person in that stadium feel like they played a part. SO happy I saw this show!!
6/18/22,Raymond James Stadium - Tampa,Took my husband for his birthday. This was the best concert that I have ever been to! He shared that same sentiment. Both artists were absolutely amazing and Coldplay put on an amazing show. The stadium was full and the crowd completely interactive. There was an educational element with regards to preservation that was amazing as well!!! The lighted wristbands were awesome and genius!!! My husband was the Coldplay fan coming into the concert. We were both fans of both artists by the end of the concert!!!
6/18/22,Raymond James Stadium - Tampa,"Absolutely loved Coldplay. They never disappoint. From the tremendous energy to the light up wrist bands coordinated to music; it was great. The one minor complaint would be that there was an echo from the back speakers. It wasn't noticeable all the time, but it was there. The venue was also great."
6/18/22,Raymond James Stadium - Tampa,"The general seating layout was horrible, everyone was crammed in and it was 95 degrees outside, folks were passing out given how crammed it was. I would suggest Coldplay rethink their seething arrangements."
6/18/22,Raymond James Stadium - Tampa,"I loved everything about the concert, although there were some songs I would have loved for Coldplay to play that they didn't, but I understand... Regardless of that, it was still a beautiful experience and the best concert I've ever been to.

BUT, the only thing I didn't like was how the venue was not prepared with the things Coldplay said it was going to do like for example having free aluminum cups with ice (heck, I would have still payed for it to be honest) and various water stations for people to get water... We weren't allowed to bring any type of water bottles inside, so we had to buy a $7 regular plastic water bottle just so that we could stay hydrated during the concert, and get this, they didn't give us the bottle cap because now they wanted to be green even though there was already a solution for that with the aluminum cups. And the whole thing about the bottle caps was weird and inconsistent because some people did have their caps with their bottles."
6/18/22,Raymond James Stadium - Tampa,"Imagine a place filled with thousands of beautiful people from all nations and colors, all genders and ages, all of them having fun and living harmoniously. People are celebrating life, treating each other with respect, equanimity, and enjoying the universal religion: Music! singing and dancing freely and joyfully. 

Well that Tuesday summer full moon night in the Tampa Buccaneer's Stadium with Coldplay was just that!
  
There was so much creativity, love and consciousness in this ritual for healing the earth!

A truly magical night full of fun, conscious awakening and gratitude from this MASTER ARTISTS they are a true inspiration and blessing to this precious planet!

Coldplay is not just a band it is a catalyst for the change our planet needs to thrive ❤️🌎🌚🌝

May all beings experience such joy and awaken to their true nature.

Om Ah Hum"
6/17/22,FedExField - Landover,"Coldplay was amazing. They can throw a show and have you smiling all night. Fireworks, interactive bracelets and a good time!"
6/17/22,Mercedes-Benz Stadium - Atlanta,"The whole experience was awesome! The sound, the brazalets and their scene experience. This is going to be unforgettable for all the people that were there."
6/17/22,Mercedes-Benz Stadium - Atlanta,Went to this concert on a whim. Did not regret it. The most amazing concert ever. If you have a chance to see coldplay live. Do it
6/17/22,MetLife Stadium - East Rutherford,"The Coldplay concert was a beautiful experience. Their set list blended a great mix of songs from their catalog and latest album. The production value was top notch. It really did feel like we were all part of the band singing along throughout the show. Coldplay is one of the best bands to experience live, if not the best, because their songs are made for big arenas. Will definitely plan to see them again in the future!"
6/17/22,Raymond James Stadium - Tampa,The absolute best! This was my 3rd show and each time they one up and it’s better than the last 💜
6/17/22,Raymond James Stadium - Tampa,Coldplay is the greatest show I’ve ever experienced. I would pay $1000 to see them. I was sad as soon as it started because I didn’t want it to end. Genuine energy and enjoyment.
6/17/22,Raymond James Stadium - Tampa,"Fireworks , songs , ambience and venue were just sensational! We came from Ireland and didn’t want the evening to end ! When are you guys coming to Dublin ??"
6/17/22,Raymond James Stadium - Tampa,Coming from Ireland it was a thrill to see Coldplay in Tampa ! The venue was incredible and the concert just amazing ! Chris and co were on point and we loved every minute of it ⭐️⭐️ I left wondering when we could see them again ☺️
6/17/22,Raymond James Stadium - Tampa,"I loved  every part of the concert.  It has been years since i have attended a concert.   My daughter picked this group because of the message in their music.    The profanity ruined some of the excitement.
I will watch the youtube version going forward."
6/17/22,Raymond James Stadium - Tampa,"David at guest service helped me with a handicap accessible seat with no hassle to pick up 
Seat location was excellent
Show was just Perfect!!"
6/17/22,Raymond James Stadium - Tampa,"This band never disappoints. Their live performance is amazing with sounds that rival their  original recording quality. The pyrotechnics, confetti, and interactive wristbands took the whole experience up to another level. The green initiatives, the inclusivity to make the concert accessible. What can I say just overall an excellent experience."
6/17/22,Raymond James Stadium - Tampa,i love how they had the light up bracelets it made the whole stadium look amazing and especially the balloons and confetti they launched into the crowd. It was a truly amazing experience.
6/17/22,Raymond James Stadium - Tampa,"This was the best concert I have ever been to. Coldplay somehow makes it feel like one big party. The bad news is that Coldplay set the bar pretty high, they have ruined all other concerts for me.

The last time I saw them was the Head Full of Dreams tour in Boston. I took my sister who didn’t know 1 song by Coldplay (crazy, I know) She turned to me in the middle of the show and said it was literally the best concert she had ever been to."
6/17/22,Raymond James Stadium - Tampa,"I like the fact that they are having initiatives to make a sustainable world, by reforesting, cleaning the oceans and making renewal energy."
6/17/22,Raymond James Stadium - Tampa,"It was perfect!   Chris was perfect.  Seeing Coldplay was on my bucket list.  I could have listened longer!  Could have had my own personal request list….but he had a great blend of his old hits and new music.  I loved the evening!  Thank you Coldplay!   Good, clean fun!"
6/17/22,Raymond James Stadium - Tampa,"I have been dying to see Coldplay for decades but they rarely come to Florida, let alone Tampa. The performace, crowd interactions, special effects and lighting made thisshow a true experience. Considering Chris Martin was so kind to make a song for us, ""Tampa Bay Tuesday"" hopefully they'll come back to see us soon. Venues should push for them to come back. I truly loved how Coldplay went above and beyond to not only provide a great show but also to make it as sustainable as possible. Perhaps venues will follow suit and do what they can to also make all shows and events sustainable."
6/17/22,Raymond James Stadium - Tampa,I’ve seen a lot of shows in my life but Coldplay was amazing!!!! The energy the engagement of the audience. The lights fireworks and the music Ofcourse. All amazing. This show moved me!!! Coldplay you are fire!!! Thank you!!!
6/17/22,Raymond James Stadium - Tampa,I've been going to shows for over 20 years and this is by far the best show I've attended to date. It was fantastic. I will definitely be seeing them again when they come back.
