Date,Place,Reviews
10/3/23,Rose Bowl - Pasadena,"You can always count on Coldplay to provide an absolutely breathtaking experience!!! The fireworks, the lights, the music. The whole package!!! However the event organisers have a lot of work to do… Getting to the arena with the shuttle was extremely smooth. However, after getting there trying to figure out how to get in and where to stand was an absolute nightmare but the worst was yet to come. Post show, it was a madhouse! No idea where to go and everyone just left stranded. We ended up WALKING an hour and when I say walking I mean a trek up and down the hill to get to a spot where we could Uber from. It was honestly pathetic and shocking and was a dampener to an otherwise incredible night! Do better Rosebowl!"
10/3/23,Rose Bowl - Pasadena,Such a great performance! Always a good time. Second time seeing them at the Rose Bowl and both times were amazing.
10/3/23,Rose Bowl - Pasadena,"Bought these tickets for my wife , she loves the band but I  had a great time the experience was great . The Coldplay fans are some of the happiest chill people you can encounter. Great concert!"
10/3/23,Rose Bowl - Pasadena,"Coldplay gave an excellent performance, from start to end it was full of energy. Rain or shine attending the concert was worth it."
10/3/23,Rose Bowl - Pasadena,"I mean it is Coldplay so it is going to be great. But it was amazing. 
The audio, the video, the extras. It was awesome. 
It was my 11yr son’s first Coldplay concert and glad he got to experience at the Rose Bowl.  We travelled from Toronto for the show!"
10/3/23,Rose Bowl - Pasadena,"Coldplay was fabulous as always but the Rose Bowl venue was a terrible experience. Long lines, they ran out of wine before the show started, and the process for leaving the venue was completely disorganized and frustrating to say the least!  Wish I hadn’t traveled 3,000 miles for the experience!"
10/3/23,Rose Bowl - Pasadena,"The concert was amazing, but the ingress and egress systems of the rose bowl are absolutely atrocious. Took us 2 hours from the end of the concert to be out of the parking structure our car was in. I don’t think I’d go back to the rose bowl for Jesus Christ himself."
10/3/23,Rose Bowl - Pasadena,"Coldplay concerts are phenomenal and one of a kind. I’ve never been to any other concert with such diversity in age and race. Probably one of the most upbeat and fun concerts you can go to. I also love that Coldplay is environmentally conscious and gives back to the community. Only negative, Rosebowl parking is terrible."
10/3/23,Rose Bowl - Pasadena,The most amazing concert I’ve ever been to! Coldplay was awesome. The lights just pushed it over the top. I had the greatest time!
10/3/23,Rose Bowl - Pasadena,"The Coldplay show at the Rose Bowl. The band and the show was wonderful. Coldplay’s show was one of the best I’ve seen and I would recommend everyone to go see one of their shows. I would love to go to another of their concerts… however, I will never go to another event at the Rose Bowl. This Venue is the absolute worst place I’ve ever been. The parking is absolutely terrible and the crew they hire to run it are nothing but children who don’t know what they are doing. If the parking situation wasn’t bad enough Getting into the stadium is itself another line that is completely out of control. The vendors inside are no different. Having the merchandise booths in the stadium made it unsafe with the congestion that the lines made at those many stands. This also created a hostile atmosphere to even try to get to a food vendor or the bathrooms. The Rose Bowl Sucks and the city of Pasadena sucks for not understanding how to organize an event. It was like this was the first time the Rose Bowl ever had an event. Never again will I go to the Rose Bowl."
10/3/23,Rose Bowl - Pasadena,Five stars ⭐️ to Coldplay for their visual and musical masterpiece of a concert - filled with impressive interactive and over-the-top spectacular surprises. 🎶 🎆 They create a casual and comfortable atmosphere. The Rose Bowl 🌹🏟️ has challenges with accommodating massive crowds.  Hoped for more smooth sailing and seamlessness. Two hours for entering and exiting a venue is too long.
10/3/23,Rose Bowl - Pasadena,"The concert was great with lots of audience interaction, made the night exciting and fun for all, even under a brief rain shower.

LED wristbands and fireworks were memorable."
10/3/23,Rose Bowl - Pasadena,A COLDPLAY concert is hard to put into words. Being surrounded by all the love and joy and positivity just transcends anything words can describe!
10/3/23,Rose Bowl - Pasadena,all in all the concert was great but brhnd the scenes it seemed unirgsnozed this year. noone was directing us ehere to go. lines literally wrapped around the parking lots to get in. merch & food ran shoet theres no enough shelter when it rained. when in did people ended up running in the tunnels but staff got upset. people started pushing each other. one ended up in a fist fight. same goes when exiting the place. theres only 1 stairs to let rows of people out. safety wise im not a fan. but the performance was great. cant wait to see them again
10/3/23,Rose Bowl - Pasadena,"Well I’m not usually a big fan of stadium shows, Coldplay certainly helped change my mind about them. They put on a great concert, with wonderful effects. The sound was incredible and a big screen to help with close up shots. One of the best concerts I have been to. Hats off to you Coldplay, job well done!"
10/3/23,Rose Bowl - Pasadena,What nice again Coldplay put on an incredibly spectacular show! Chris Martin is a true entertainer and obviously loves what he does. Such talented artists and I really felt honored to be part of such powerful musical event. Bringing Christina up on stage for her birthday serenade was a class act and was absolutely beautiful to watch. Thanks Coldplay and look forward to the next tour if you’re up for it!
10/3/23,Rose Bowl - Pasadena,Coldplay concert is probably the best concert I’ve been to. They get everyone involved. I would not mind taking my kids to this as well. Very entertaining. Only bad part of this is the venue they chose to perform at. Rose Bowl sucks! This place to get in and out of is ridiculous. I will not attend a concert here
10/3/23,Rose Bowl - Pasadena,"Coldplay performed amazingly with the mesmerizing technicolor wonder. Even though it rained a bit, the performance went off without a hitch. The only negative aspect was the venue. Rose Bowl is a terrible venue. Every time, we get burned by the same lack of organization, parking, shuttle, ride share debacle. It took us over 2.5 hours to leave the venue."
10/3/23,Rose Bowl - Pasadena,The band and the design team said let's do what we have always dreamed of doing and they succeed.  They incorporated so much in this incredible show from light to sustainability from characters to incorporated culture and languages.  There was something for everyone. This did not include the incredible music. My favorite was People of the Pride.
10/3/23,Rose Bowl - Pasadena,"Such an incredible show from beginning to end. Coldplay was awesome; high energy--great GREAT visuals---the lights in the audience rival any other show I've been to. Confetti cannons; fireworks; synchronized lights and tons of positive and loving energy. Love this band. Excellent show! 

Rose Bowl was a CLUSTER to leave and get on the shuttle line. Though we exited right at the shuttles from the stadium we had to walk to the very opposite end of the parking lot to get on a line that had been exponentially growing in the time it took us to get there. It was a LOT and took over an hour to get on the shuttle."
10/3/23,Rose Bowl - Pasadena,"I've been attending concerts for over 40 years.  I've seen some of the greatest bands of all time.  But, I've never been to a show like the one Coldplay put on at the Rose Bowl, Pasadena CA.  Spectacular!  Fan inclusive.  Lighting was extravagant.  Every song had you standing and dancing and singing.  MUST SEE!"
10/3/23,Rose Bowl - Pasadena,The tittle says it all. The concert was a great experience but lines was not organized. No signs which side you were lining up. The lines were all over the place.  No staff near to help.
10/3/23,Rose Bowl - Pasadena,"First off, the concert itself was hands down, the best concert I’ve been to. The band was great, interaction with the crowd was great. Far exceeded my expectations. The downside of the concert experience at the Rose Bowl was the venue itself. Total lack of communication between venue employees as to where will call and availability of will call tickets, parking was by far the worst experience of my life. Took 2 1/2 hours to get out of the parking lot after the show because there weren’t any (or enough) parking lot and traffic control employees present to help disperse the crowd. The shortage of food after only  1 1/2 hrs at some food stands and the prices charged for the quantity of food was ridiculous. It was clear to me that the Rose Bowl was not ready for the amount of people that attended this concert. It’s no secret that Cold Play draws the largest number of fans wherever they play and it wasn’t like this concert was just added to the tour two weeks ago. I will never go back to the Rose Bowl for another concert again"
10/3/23,Rose Bowl - Pasadena,Even with the rain and early arrival it was another memorable experience seeing Coldplay. Second time seeing them at the rose bowl wish it was a longer set lol! They have toooo many hits. Monique was the best she helped my husband and I get seats to accommodate his needs.
10/3/23,Rose Bowl - Pasadena,"We loved the Coldplay concert.  The band is absolutely amazing and their show was colorful and spectacular!   Chris Martin is a gracious, grateful, humble, engaging, and joyful lead singer which draws a great diverse crowd of music lovers together for an uplifting, positive, and joyful concert experience!"
10/3/23,Rose Bowl - Pasadena,"One of the bestest concert exprience.  The rains made it more memorable :) Thank you Chris, Guym Jonny and Will.  You're so amazing!"
10/3/23,Rose Bowl - Pasadena,Absolutely loved the concert!!! Coldplay rocked it! The venue however was a struggle. It was such a mission to leave the venue and very disorganized
10/3/23,Rose Bowl - Pasadena,"A show where you sing and dance the entire time!! Best fireworks, confetti , fan interaction!! A must see !!! Coldplay never disappoints!!!"
10/3/23,Rose Bowl - Pasadena,"Coldplay was incredible, easily the best live performance we've ever seen.  They performed for two hours straight.  The vibe and energy of the crowd was intense; everyone was dancing, singing, laughing - not an empty seat in sight.  It was like being transported to some other place without hatred, racism, bigotry, prejudices.  It was peace and love and it was like the entire stadium became one.  They did such a good job..  Oh, and the bracelets were unreal!  In a world full of hate, it was quite emotional to find something like this, something full of love!"
10/3/23,Rose Bowl - Pasadena,"Coldplay puts on a good show but under two hours is a joke, especially for the price of admission. They have the material to go longer and left out some hits. Oh well."
10/3/23,Rose Bowl - Pasadena,"It was an amazing concert, 10/10 experience. Would highly recommend it, Coldplay never disappoints, it was a concert i was looking forward to since the summer of 2021 and it was just an amazing concert overall!"
10/3/23,Rose Bowl - Pasadena,Epic. Nothing shy of pure magic.  The performance has been distilled into a unique experience carefully crafted to have such beautiful interaction and punch its out of a movie.
10/3/23,Rose Bowl - Pasadena,"Magical. Absolutely amazing, engaging. Best concert I have ever attended in my life. I would go again in a heartbeat."
10/3/23,Rose Bowl - Pasadena,"Amazing production, so much thought put into this show. Very eco friendly and had positive messages. LOVE!!! DEFINITELY RECOMMEND!!"
10/3/23,Rose Bowl - Pasadena,"From the show start to the end, it was full of emotions, great sound, excellent light effects. Musicians were giving themselves to the crowd! amazing"
10/3/23,Rose Bowl - Pasadena,Coldplay puts on the BEST concerts.  You can see the passion for music when Chris is performing.  The lights and fireworks are spectacular.  H.E.R. was an awesome performer as well.  Such talent.  Can't wait until they all come to town again!
10/3/23,Snapdragon Stadium - San Diego,Okayish performance compared to previous concerts I have attended. The wristbands lights were for a very short time and not very good.
10/3/23,Snapdragon Stadium - San Diego,My hubby & I had a blast seeing Coldplay for the first time at Snapdragon stadium in San Diego Sept 28!  They were humble and put on a fantastic show!  So glad we didn’t miss this opportunity to see them so close to home.  LOVE COLDPLAY!!!
10/3/23,Snapdragon Stadium - San Diego,"Absolutely loved the concert! Loved all the songs played by Chris. I just felt the sound system was not at par with their previous concert in San Diego. Also for a few songs the wrist band (lighting effect) was not turned on (like for Viva la Vida). Not sure if that was intentional but would have loved more lighting around that song.
Overall great experience just a few things here and there that could have been better. Also i am not entirely sure but looks like Chris ended it a little earlier than what I expected."
10/3/23,Snapdragon Stadium - San Diego,"Coldplay TOTALLY brought the energy, enthusiasm, fun, and connection with the crowd. But unlike the other three Coldplay shows I've attended in the past, this one was different. Being on the floor was a disaster what with all of the constant video taping by other concert goers around me. I am only 5'11"", and I couldn't see most of the show due to the perpetual video taping of every song by everyone around me. I will not plan to be on the floor at a Cold play performance again in the future. Why can't folks just be in the moment and enjoy the music and the crowd with their own eyes instead of through the screen of their phones?"
10/2/23,Lumen Field - Seattle,"It was so engaging that I felt like it was more of a personal experience than a crowd of almost 70,000! Loved the way it brought us closer to everyone around us and made us want to be better people."
10/2/23,Snapdragon Stadium - San Diego,"Coldplay was amazing!! Had such a great time, they played a wide variety of songs and really incorporated the fans well!"
10/2/23,Snapdragon Stadium - San Diego,"Coldplay's live performances are nothing short of spectacular. Their concerts are a visual and auditory feast, with stunning visuals, vibrant light displays, and Chris Martin's infectious energy captivating audiences worldwide. The band's ability to connect with their fans on such an intimate level, creating an atmosphere of unity and collective euphoria, is a testament to their genuine love for their craft.

Coldplay's enchanting melodies and thought-provoking lyrics will undoubtedly leave you craving for more.

Truly one of the beat shows I have seen!"
10/2/23,Snapdragon Stadium - San Diego,"I saw their concert in 2016 in Rose Bowl Pasadena, I think it was much better that time. I expected more this time or at least for it to be different."
10/2/23,Snapdragon Stadium - San Diego,"I have never seen HER perform in person and I thought she was just beautiful, talented and inspirational. I had no idea she played so many instruments! 

And then Coldplay! just WOW!! from the wrist bracelets that lit up the stadium, the balls the audience played with, fireworks, to the outstanding music and performance - Coldplay didn't disappoint and I had a blast!! worth every penny! And I was impressed that so many young people were in attendance and that Coldplay still resonated with so many different genres of people after all these years! 

The Snapdragon stadium gets A+ for their help exchanging our tickets to the ADA section for our guest who was handicapped. It was so easy! Thank you!"
10/2/23,Snapdragon Stadium - San Diego,The Coldplay concert was magical. All the lights combined with the crowds energy was amazing. They put on such an incredible experience.
10/2/23,Snapdragon Stadium - San Diego,The concert itself was Amazing!  The VIP seats were awful.  People who bought other seats were crowding the bottom of the stands.  Never again will I be purchasing seats like these.  Totally not worth the money spent.
10/2/23,Snapdragon Stadium - San Diego,"If there’s anything that could beat this experience? It’d be another Coldplay live show. They leave their soul on stage, connect with fans, protect the planet, raise awareness about social justice, and definitely do their magic to make the show a lifetime experience. What a combo! It was absolute paradise. I considered the show like my 50th Bday party since I could not celebrate it because I’d recently lost my mom. I had the bestest time of my life. My sign didn’t catch Chris’ attention so I could join them on stage, but that was OK, I wanted the show to last forever."
10/2/23,Snapdragon Stadium - San Diego,"The show was amazing, we love these guys!!! We got into the Venue smoothly and it is very nice, the food and drink options were great. The one thing we could see an improvement on would be exiting the Venue, we were at the very back of the parking and it felt like their was no movement for an hour. It seemed that there should have been another route to exit from."
10/2/23,Snapdragon Stadium - San Diego,"Coldplay was AMAZING! The whole atmosphere of everything. I liked how a free trolly ride was optional. Getting into the concert was a breeze, did not have any issues when it came to getting into the stadium and leaving. Definitely would see Coldplay again, there concert is something I feel everyone should have the opportunity to see."
10/2/23,Snapdragon Stadium - San Diego,"From the music, choreographed wristband lights, and audience participation to Chris Martin's obvious love for his fans and his craft - absolutely one of the best live performances I've seen."
10/2/23,Snapdragon Stadium - San Diego,We celebrated our 30th anniversary at this concert. It was over the top! Every song was beautiful! They are so talented and put on an awesome show. We love Coldplay and would recommend their music to everyone.
10/2/23,Snapdragon Stadium - San Diego,Coldplay put on a stunning visual concert.  The wristbands made the experience immersive and the show was spectacular.  The new album started off the show and set the tone for the thousands in attendance to experience a great communal celebration of this world.  There was a clear message that we all need to be part of the solution.
10/2/23,Snapdragon Stadium - San Diego,"Coldplay at Snap(rape)Dragon Stadium was OK. We were pretty far up in the stands. They seemed to pump in a lot of their music. The music meshed in together with all songs. My fav was Clocks.
How can security let you walk through the metal detectors with a phone in your hand, then let you keep walking, what if I had a gun in my boot? Security should be much tighter."
10/2/23,Snapdragon Stadium - San Diego,The venue was awesome!  The concert was amazing!  By far the best concert I’ve ever been to!  I was very impressed.  Love Coldplay and what they stand for.  They really have it together!  Chris Martin is great!  Can’t wait to go to another one of their concerts!
10/2/23,Snapdragon Stadium - San Diego,"This was my third Coldplay show and I LOVED IT!  It was so good, I’m still listening to the playlist. I’m still walking on cloud nine.  Please come back sooner than 5 years."
10/2/23,Snapdragon Stadium - San Diego,"This is more than a concert. It is an experience. Coldplay has remastered what it means to be at a concert. Performing among massive, sold out crowds, Coldplay ensures every minute you are there watching them is filled with joy, entertainment, and love. Additionally, they have made significant efforts to reduce the carbon footprint through recycling programs and reusable energy efforts. The only negative is every concert you see after this one will never measure up."
10/2/23,Snapdragon Stadium - San Diego,"It was the best concert of my life, Coldplay it's my favorite band since 14 years old, but I'm so sad because my wristband didn't turn on."
10/2/23,Snapdragon Stadium - San Diego,"They are the best band in the whole world, their show is completely amazing, this show is a must in your life even if you are not a fan"
10/1/23,Snapdragon Stadium - San Diego,"Seeing Coldplay live will always be an experience I'll never forget. I wated to see them back in 2017 when they came to SD (I live in Tijuana), but I could not afford to buy tickets. So, in 2021 I was finally able to buy tickets for L.A., but sadly it was cancelled. Before they cancelled, I was still trying to figure out how I was going to get there since I didn't have a driver's license, so the way I saw it was ""Ok, it's fine. They knew you needed to get your life together still, so they're giving you some time and I bet when they release new dates it will be in SD instead, and it'll be better for you, it'll be closer"". And that's what happened: I got my driver's license, car and they announced new dates for SD, which made me think, ""That's how wholesome they are! THANK YOU!"". And just as I expected, it was worth every single day. Their shows are really out of this world."
10/1/23,Snapdragon Stadium - San Diego,"The Coldplay concert was nothing short of a spectacular experience. As the music filled the air, the audience became an enchanting spectacle themselves, thanks to the synchronized light-up wristbands that accompanied the performance. It was an unforgettable, immersive journey that left an indelible mark.

Coldplay's ability to involve the crowd was a testament to their showmanship. With each iconic hit, the entire arena transformed into a massive choir, singing in unison. The energy in the venue was electrifying, and it felt like a collective celebration of their timeless music.

This show was a testament to Coldplay's status as one of the world's greatest live bands. Their passion and connection with the audience were palpable throughout the night. The anticipation for the next opportunity to witness such a remarkable performance is already building – I can't wait to see them again."
10/1/23,Snapdragon Stadium - San Diego,"Went with my 17 yr old son- love bands that span generations! Such a fun show, what an iconic band performance! The light show was fantastic, energy was high, and interaction with the audience was so fun! Chris Martin provided an unparalleled engagement opportunity to a couple up on stage in addition to keeping a promise from last year of having someone singing a song with him on stage! Just so cool to see the guys in person. Would 100% go again if I get the opportunity. And of course I could listen to Chris Martin's voice any time!!"
10/1/23,Snapdragon Stadium - San Diego,This is the second time seeing Coldplay’s Music of the Spheres. Both times I traveled out of state to be a part of this magical musical experience! I don’t think I can ever get bored or tired of seeing this band perform live. Shout out to Snapdragon Stadium! Great venue!
10/1/23,Snapdragon Stadium - San Diego,"I had the best time ever. The atmosphere/vibe was amazing! If you have not already seen Coldplay, you absolutely need to!!"
10/1/23,Snapdragon Stadium - San Diego,"Fabulous concert experience as always with Coldplay ✨Music of the Spheres World Tour was filled with amazing energy, giant colorful balloon globes, a sea of confetti and shared voices from around the world! Incredible! Thank you, Coldplay 🌎🩷❤️🧡💛💚🩵💙💜 #ColdplaySanDiego"
10/1/23,Snapdragon Stadium - San Diego,The Coldplay concert was one of the best I have ever attended. Loved the use of multiple stages and the continuous light show throughout the concert.  The music was excellent!  The venue access was poor.  The traffic between the access highway and the stadium parking was a free for all with little to no police or traffic controllers.  The constant cutting in traffic lines made it impossible to exit off of highway I-15 on to Friers Rd.  I will not attend another concert at Snapdragon until they learn to manage their access to the stadium. It took 1 1/2 hours to exit the highway and get to the parking lot.
10/1/23,Snapdragon Stadium - San Diego,"Coldplay never disappoints in my opinion, I have been following the MOTSWT since they started and was excited to see them and have the same experience all Coldplay fans were having. Thank you for giving us the best of You!"
10/1/23,Snapdragon Stadium - San Diego,"2nd time seeing Coldplay and as usual they did not disappoint! It’s always such a pleasure seeing the guys and it’s always such a joyful occasion. With HER being their front act as well it was like you paid for 2 of the best artist in 1. Me as an ARMY as well, them performing My Universe with BTS on the big screen makes all Coldplay/BTS ARMY heart happy! Thank you Coldplay for such an AWESOME show!"
10/1/23,Snapdragon Stadium - San Diego,"Coldplay rocked Qualcomm in 2017, six years later they brought down the house again!  Such a good show.  Coldplay really knows how to make their fans included and entertained!!  Best part was the fake on Sky Full of Stars!  Fun way to get to the end of a show - there was an encore so definitely more music!!!"
